classifyLevel-int,desc-string,displayType-int,icon-string,id-int,level-int,matItemId-int[][],name-string,productId-int[][],productTypes-int[],proficiency-int,recipesSort-int,sourceText-int,timeCost-int,timesLimit-int,type-int,unlockCondition-int,unlockType-int,useDitamin-int,useToken-int
0,Recast Curse Kettle Anda,2,recipe-icon-463,463,2,"85,1;207,2",Lv 2 Ketel Terkutuk Dilebur Ulang,"85,2,1,10000",1,0,10800463,1,5,-,1,0,4,0,0
0,Recast Crystal Skin Boots Anda,2,recipe-icon-464,464,2,"56,1;213,1;210,1",Lv 2 Sepatu Bot Kulit Kristal Dilebur Ulang,"56,2,1,10000",1,0,10800464,1,5,-,2,0,4,0,0
0,Recast Gathering Jacket Anda,2,recipe-icon-465,465,2,"120,1;216,2",Lv 2 Jaket Pengumpulan Dilebur Ulang,"120,2,1,10000",1,0,10800465,1,5,-,3,0,4,0,0
0,Recast Curse Hoe Anda,2,recipe-icon-466,466,2,"81,1;207,2",Lv 2 Cangkul Terkutuk Dilebur Ulang,"81,2,1,10000",1,0,10800466,1,5,-,1,0,4,0,0
0,Recast Crystal Skin Soft Hat Anda,2,recipe-icon-467,467,2,"44,1;213,1;210,1",Lv 2 Topi Kristal Helm Prajurit Dilebur Ulang,"44,2,1,10000",1,0,10800467,1,5,-,2,0,4,0,0
0,Recast Curse Axe Anda,2,recipe-icon-468,468,2,"93,1;216,2",Lv 2 Kapak Terkutuk Dilebur Ulang,"93,2,1,10000",1,0,10800468,1,5,-,3,0,4,0,0
0,Recast Crystal Skin Glove Anda,2,recipe-icon-469,469,2,"53,1;213,1;210,1",Lv 2 Sarung Tangan Prajurit Sarung Tangan Kulit Kristal Dilebur Ulang,"53,2,1,10000",1,0,10800469,1,5,-,2,0,4,0,0
0,Recast Crystal Skin Pant Anda,2,recipe-icon-470,470,2,"50,1;213,1;210,1",Lv 2 Celana Prajurit Celana Kulit Kristal Dilebur Ulang,"50,2,1,10000",1,0,10800470,1,5,-,2,0,4,0,0
0,Recast Crystal Skin Armor Anda,2,recipe-icon-471,471,2,"47,1;213,1;210,1",Lv 2 Atasan Prajurit Atasan Kulit Kristal Dilebur Ulang,"47,2,1,10000",1,0,10800471,1,5,-,2,0,4,0,0
0,Recast Farming Shoes Anda,2,recipe-icon-472,472,2,"111,1;207,2",Lv 2 Sepatu Pertanian Dilebur Ulang,"111,2,1,10000",1,0,10800472,1,5,-,1,0,4,0,0
0,Recast Farming Pants Anda,2,recipe-icon-473,473,2,"105,1;207,2",Lv 2 Celana Pertanian Dilebur Ulang,"105,2,1,10000",1,0,10800473,1,5,-,1,0,4,0,0
0,Recast Gathering Gloves Anda,2,recipe-icon-474,474,2,"126,1;216,2",Lv 2 Sarung Tangan Pengumpulan Dilebur Ulang,"126,2,1,10000",1,0,10800474,1,5,-,3,0,4,0,0
0,Recast Iron Brush Anda,2,recipe-icon-475,475,2,"454,1;207,2",Lv 2 Sikat Besi Dilebur Ulang,"454,2,1,10000",1,0,10800475,1,5,-,1,0,4,0,0
0,Recast Gathering Pants Anda,2,recipe-icon-476,476,2,"123,1;216,2",Lv 2 Celana Pengumpulan Dilebur Ulang,"123,2,1,10000",1,0,10800476,1,5,-,3,0,4,0,0
0,Recast Gathering Shoes Anda,2,recipe-icon-477,477,2,"114,1;216,2",Lv 2 Sepatu Pengumpulan Dilebur Ulang,"114,2,1,10000",1,0,10800477,1,5,-,3,0,4,0,0
0,Recast Gathering Hat Anda,2,recipe-icon-478,478,2,"117,1;216,2",Lv 2 Topi Pengumpulan Dilebur Ulang,"117,2,1,10000",1,0,10800478,1,5,-,3,0,4,0,0
0,Recast Iron Sword Anda,2,recipe-icon-479,479,2,"41,1;213,1;210,1",Lv 2 Pedang Besi Dilebur Ulang,"41,2,1,10000",1,0,10800479,1,5,-,2,0,4,0,0
0,Recast Iron Sickle Anda,2,recipe-icon-480,480,2,"227,1;216,2",Lv 2 Sabit Besi Dilebur Ulang,"227,2,1,10000",1,0,10800480,1,5,-,3,0,4,0,0
0,Recast Lucky Cotton Hat Anda,2,recipe-icon-481,481,2,"99,1;207,2",Lv 2 Topi Kapas Beruntung Dilebur Ulang,"99,2,1,10000",1,0,10800481,1,5,-,1,0,4,0,0
0,Recast Iron Hammer Anda,2,recipe-icon-482,482,2,"442,1;213,1;210,1",Lv 2 Palu Besi Dilebur Ulang,"442,2,1,10000",1,0,10800482,1,5,-,2,0,4,0,0
0,Recast Crystal Sickle Anda,2,recipe-icon-483,483,3,"228,1;217,2",Lv 3 Sabit Kristal Dilebur Ulang,"228,2,1,6000;228,3,1,4000",1,0,50700483,1,5,-,3,0,4,0,0
0,Recast Gathering Shoes Anda,2,recipe-icon-484,484,3,"217,2;115,1",Lv 3 Sepatu Pengumpulan Dilebur Ulang,"115,2,1,6000;115,3,1,4000",1,0,50700484,1,5,-,3,0,4,0,0
0,Recast Gathering Hat Anda,2,recipe-icon-485,485,3,"217,2;118,1",Lv 3 Topi Pengumpulan Dilebur Ulang,"118,2,1,6000;118,3,1,4000",1,0,50700485,1,5,-,3,0,4,0,0
0,Recast Gathering Jacket Anda,2,recipe-icon-486,486,3,"217,2;121,1",Membuat Ulang Jaket Pengumpulan Lv 3,"121,2,1,6000;121,3,1,4000",1,0,50700486,1,5,-,3,0,4,0,0
0,Recast Gathering Gloves Anda,2,recipe-icon-487,487,3,"208,2;127,1",Membuat Ulang Sarung Tangan Pengumpulan Lv 3,"127,2,1,6000;127,3,1,4000",1,0,50700487,1,5,-,3,0,4,0,0
0,Tingkatkan ulang Sepatu Pertanian Anda,2,recipe-icon-488,488,3,"217,2;112,1",Membuat Ulang Sepatu Pertanian Lv 3,"112,2,1,6000;112,3,1,4000",1,0,50700488,1,5,-,1,0,4,0,0
0,Recast Crystal Sword Anda,2,recipe-icon-489,489,3,"42,1;214,1;211,1",Membuat Ulang Pedang Kristal Lv 3,"42,2,1,6000;42,3,1,4000",1,0,50700489,1,5,-,2,0,4,0,0
0,Recast Crystal Brush Anda,2,recipe-icon-490,490,3,"455,1;208,2",Membuat Ulang Sikat Kristal Lv 3,"455,2,1,6000;455,3,1,4000",1,0,50700490,1,5,-,1,0,4,0,0
0,Recast Blessed Axe Anda,2,recipe-icon-491,491,3,"94,1;217,2",Membuat Ulang Kapak yang Diberkati Lv 3,"94,2,1,6000;94,3,1,4000",1,0,50700491,1,5,-,3,0,4,0,0
0,Recast Crystal Hammer Anda,2,recipe-icon-492,492,3,"443,1;214,1;211,1",Membuat Ulang Palu Kristal Lv 3,"443,2,1,6000;443,3,1,4000",1,0,50700492,1,5,-,2,0,4,0,0
0,Recast Crystal Leg Armor Anda,2,recipe-icon-493,493,3,"51,1;214,1;211,1",Membuat Ulang Pelindung Kaki Kristal Lv 3,"51,2,1,6000;51,3,1,4000",1,0,50700493,1,5,-,2,0,4,0,0
0,Recast Crystal Bow Anda,2,recipe-icon-494,494,3,"289,1;214,1;211,1",Membuat Ulang Busur Kristal Lv 3,"289,2,1,6000;289,3,1,4000",1,0,50700494,1,5,-,2,0,4,0,0
0,Recast Crystal Stone Gauntlet Anda,2,recipe-icon-495,495,3,"54,1;214,1;211,1",Membuat Ulang Sarung Tangan Batu Kristal Lv 3,"54,2,1,6000;54,3,1,4000",1,0,50700495,1,5,-,2,0,4,0,0
0,Recast Crystal Stone Helmet Anda,2,recipe-icon-496,496,3,"45,1;214,1;211,1",Membuat Ulang Helm Batu Kristal Lv 3,"45,2,1,6000;45,3,1,4000",1,0,50700496,1,5,-,2,0,4,0,0
0,Recast Crystal Stone Armor Anda,2,recipe-icon-497,497,3,"48,1;214,1;211,1",Membuat Ulang Armor Batu Kristal Lv 3,"48,2,1,6000;48,3,1,4000",1,0,50700497,1,5,-,2,0,4,0,0
0,Recast Crystal Stone Shoes Anda,2,recipe-icon-498,498,3,"57,1;214,1;211,1",Membuat Ulang Sepatu Batu Kristal Lv 3,"57,2,1,6000;57,3,1,4000",1,0,50700498,1,5,-,2,0,4,0,0
0,Recast Farming Pants Anda,2,recipe-icon-499,499,3,"106,1;208,2",Membuat Ulang Celana Pertanian Lv 3,"106,2,1,6000;106,3,1,4000",1,0,50700499,1,5,-,1,0,4,0,0
0,Recast Farming Gloves Anda,2,recipe-icon-500,500,3,"109,1;208,2",Membuat Ulang Sarung Tangan Pertanian Lv 3,"109,2,1,6000;109,3,1,4000",1,0,50700500,1,5,-,1,0,4,0,0
0,Recast Farming Jacket Anda,2,recipe-icon-501,501,3,"103,1;208,2",Membuat Ulang Jaket Pertanian Lv 3,"103,2,1,6000;103,3,1,4000",1,0,50700501,1,5,-,1,0,4,0,0
0,Recast Gathering Pants Anda,2,recipe-icon-503,503,3,"217,2;124,1",Membuat Ulang Celana Pengumpulan Lv 3,"124,2,1,6000;124,3,1,4000",1,0,50700503,1,5,-,3,0,4,0,0
0,Recast Blessing Pickaxe Anda,2,recipe-icon-504,504,3,"90,1;217,2",Membuat Ulang Beliung yang Diberkati Lv 3,"90,2,1,6000;90,3,1,4000",1,0,50700504,1,5,-,3,0,4,0,0
0,Recast Blessing Hoe Anda,2,recipe-icon-505,505,3,"82,1;208,2",Membuat Ulang Cangkul yang Diberkati Lv 3,"82,2,1,6000;82,3,1,4000",1,0,50700505,1,5,-,1,0,4,0,0
0,Recast Blessing Kettle Anda,2,recipe-icon-506,506,3,"86,1;208,2",Membuat Ulang Ketel yang Diberkati Lv 3,"86,2,1,6000;86,3,1,4000",1,0,50700506,1,5,-,1,0,4,0,0
0,Recast Golden Hoe Anda,2,recipe-icon-507,507,4,"299,1;209,2",Membuat Ulang Cangkul Emas Lv 4,"299,2,1,4736;299,3,1,3157;299,4,1,2105",1,0,50600507,1,5,-,1,0,4,0,5000
0,Recast Golden Fighter Coat Anda,2,recipe-icon-508,508,4,"336,1;215,1;212,1",Membuat Ulang Mantel Petani Emas Lv 4,"336,2,1,4736;336,3,1,3157;336,4,1,2105",1,0,50600508,1,5,-,2,0,4,0,5000
0,Recast Golden Farmer Pants Anda,2,recipe-icon-509,509,4,"353,1;209,2",Membuat Ulang Celana Petani Emas Lv 4,"353,2,1,4736;353,3,1,3157;353,4,1,2105",1,0,50600509,1,5,-,1,0,4,0,5000
0,Recast Golden Farmer Shoes Anda,2,recipe-icon-510,510,4,"354,1;209,2",Membuat Ulang Sepatu Petani Emas Lv 4,"354,2,1,4736;354,3,1,3157;354,4,1,2105",1,0,50600510,1,5,-,1,0,4,0,5000
0,Recast Golden Fighter Glove Anda,2,recipe-icon-511,511,4,"337,1;215,1;212,1",Membuat Ulang Sarung Tangan Petarung Emas Lv 4,"337,2,1,4736;337,3,1,3157;337,4,1,2105",1,0,50600511,1,5,-,2,0,4,0,5000
0,Recast Golden Fighter Hat Anda,2,recipe-icon-512,512,4,"335,1;215,1;212,1",Lv 4 Topi Petarung Emas Dicetak Ulang,"335,2,1,4736;335,3,1,3157;335,4,1,2105",1,0,50600512,1,5,-,2,0,4,0,5000
0,Recast Golden Hammer Anda,2,recipe-icon-513,513,4,"444,1;215,1;212,1",Lv 4 Palu Emas Dicetak Ulang,"444,2,1,4736;444,3,1,3157;444,4,1,2105",1,0,50600513,1,5,-,2,0,4,0,5000
0,Recast Golden Axe Anda,2,recipe-icon-514,514,4,"300,1;218,2",Lv 4 Kapak Emas Dicetak Ulang,"300,2,1,4736;300,3,1,3157;300,4,1,2105",1,0,50600514,1,5,-,3,0,4,0,5000
0,Recast Golden Gather Coat Anda,2,recipe-icon-515,515,4,"321,1;218,2",Lv 4 Mantel Pengumpul Emas Dicetak Ulang,"321,2,1,4736;321,3,1,3157;321,4,1,2105",1,0,50600515,1,5,-,3,0,4,0,5000
0,Recast Golden Gather Shoes Anda,2,recipe-icon-516,516,4,"324,1;218,2",Lv 4 Sepatu Pengumpul Emas Dicetak Ulang,"324,2,1,4736;324,3,1,3157;324,4,1,2105",1,0,50600516,1,5,-,3,0,4,0,5000
0,Recast Golden Fighter Pants Anda,2,recipe-icon-517,517,4,"338,1;215,1;212,1",Lv 4 Celana Petarung Emas Dicetak Ulang,"338,2,1,4736;338,3,1,3157;338,4,1,2105",1,0,50600517,1,5,-,2,0,4,0,5000
0,Recast Golden Fighter Shoes Anda,2,recipe-icon-518,518,4,"339,1;215,1;212,1",Lv 4 Sepatu Petarung Emas Dicetak Ulang,"339,2,1,4736;339,3,1,3157;339,4,1,2105",1,0,50600518,1,5,-,2,0,4,0,5000
0,Recast Golden Gather Pants Anda,2,recipe-icon-519,519,4,"323,1;218,2",Lv 4 Celana Pengumpul Emas Dicetak Ulang,"323,2,1,4736;323,3,1,3157;323,4,1,2105",1,0,50600519,1,5,-,3,0,4,0,5000
0,Recast Golden Farmer Coat Anda,2,recipe-icon-520,520,4,"351,1;209,2",Lv 4 Mantel Petani Emas Dicetak Ulang,"351,2,1,4736;351,3,1,3157;351,4,1,2105",1,0,50600520,1,5,-,1,0,4,0,5000
0,Recast Golden Bow Anda,2,recipe-icon-521,521,4,"450,1;215,1;212,1",Lv 4 Busur Emas Dicetak Ulang,"450,2,1,4736;450,3,1,3157;450,4,1,2105",1,0,50600521,1,5,-,2,0,4,0,5000
0,Recast Golden Brush Anda,2,recipe-icon-522,522,4,"456,1;209,2",Lv 4 Sikat Emas Dicetak Ulang,"456,2,1,4736;456,3,1,3157;456,4,1,2105",1,0,50600522,1,5,-,1,0,4,0,5000
0,Recast Golden Farmer Glove Anda,2,recipe-icon-523,523,4,"352,1;209,2",Lv 4 Sarung Tangan Petani Emas Dicetak Ulang,"352,2,1,4736;352,3,1,3157;352,4,1,2105",1,0,50600523,1,5,-,1,0,4,0,5000
0,Recast Golden Gather Glove Anda,2,recipe-icon-524,524,4,"322,1;218,2",Lv 4 Sarung Tangan Pengumpul Emas Dicetak Ulang,"322,2,1,4736;322,3,1,3157;322,4,1,2105",1,0,50600524,1,5,-,3,0,4,0,5000
0,Recast Golden Gather Hat Anda,2,recipe-icon-525,525,4,"320,1;218,2",Lv 4 Topi Pengumpul Emas Dicetak Ulang,"320,2,1,4736;320,3,1,3157;320,4,1,2105",1,0,50600525,1,5,-,3,0,4,0,5000
0,Recast Golden Farmer Hat Anda,2,recipe-icon-526,526,4,"350,1;209,2",Lv 4 Topi Petani Emas Dicetak Ulang,"350,2,1,4736;350,3,1,3157;350,4,1,2105",1,0,50600526,1,5,-,1,0,4,0,5000
0,Recast Golden Kettle Anda,2,recipe-icon-528,528,4,"304,1;209,2",Lv 4 Ketel Emas Dicetak Ulang,"304,2,1,4736;304,3,1,3157;304,4,1,2105",1,0,50600528,1,5,-,1,0,4,0,5000
0,Recast Golden Pickaxe Anda,2,recipe-icon-529,529,4,"301,1;218,2",Lv 4 Beliung Emas Dicetak Ulang,"301,2,1,4736;301,3,1,3157;301,4,1,2105",1,0,50600529,1,5,-,3,0,4,0,5000
0,Buat ulang Cangkul Berlian Anda,2,recipe-icon-530,530,5,"305,1;404,2",Lv 5 Cangkul Berlian Dicetak Ulang,"305,2,1,4426;305,3,1,2950;305,4,1,1967;305,5,1,655",1,0,50500530,1,5,-,1,0,4,0,7500
0,Buat ulang Jas Pejuang Berlian Anda,2,recipe-icon-531,531,5,"341,1;410,1;407,1",Lv 5 Mantel Petarung Berlian Dicetak Ulang,"341,2,1,4426;341,3,1,2950;341,4,1,1967;341,5,1,655",1,0,50500531,1,5,-,2,0,4,0,7500
0,Buat ulang Celana Petani Berlian Anda,2,recipe-icon-532,532,5,"358,1;404,2",Lv 5 Celana Petani Berlian Dicetak Ulang,"358,2,1,4426;358,3,1,2950;358,4,1,1967;358,5,1,655",1,0,50500532,1,5,-,1,0,4,0,7500
0,Buat ulang Sepatu Petani Berlian Anda,2,recipe-icon-533,533,5,"359,1;404,2",Lv 5 Sepatu Petani Berlian Dicetak Ulang,"359,2,1,4426;359,3,1,2950;359,4,1,1967;359,5,1,655",1,0,50500533,1,5,-,1,0,4,0,7500
0,Buat ulang Sarung Tangan Pejuang Berlian Anda,2,recipe-icon-534,534,5,"342,1;410,1;407,1",Lv 5 Sarung Tangan Petarung Berlian Dicetak Ulang,"342,2,1,4426;342,3,1,2950;342,4,1,1967;342,5,1,655",1,0,50500534,1,5,-,2,0,4,0,7500
0,Buat ulang Topi Pejuang Berlian Anda,2,recipe-icon-535,535,5,"340,1;410,1;407,1",Lv 5 Topi Petarung Berlian Dicetak Ulang,"340,2,1,4426;340,3,1,2950;340,4,1,1967;340,5,1,655",1,0,50500535,1,5,-,2,0,4,0,7500
0,Buat ulang Palu Berlian Anda,2,recipe-icon-536,536,5,"445,1;410,1;407,1",Lv 5 Palu Berlian Dicetak Ulang,"445,2,1,4426;445,3,1,2950;445,4,1,1967;445,5,1,655",1,0,50500536,1,5,-,2,0,4,0,7500
0,Recast Diamond Axe Anda,2,recipe-icon-537,537,5,"306,1;401,2",Lv 5 Diamond Axe Recasting: Pengecoran Ulang Kapak Berlian Lv 5,"306,2,1,4426;306,3,1,2950;306,4,1,1967;306,5,1,655",1,0,50500537,1,5,-,3,0,4,0,7500
0,Buat ulang Sepatu Pengumpul Berlian Anda,2,recipe-icon-538,538,5,"329,1;401,2",Lv 5 Diamond Gather Shoes Recasting: Pengecoran Ulang Sepatu Pengumpul Berlian Lv 5,"329,2,1,4426;329,3,1,2950;329,4,1,1967;329,5,1,655",1,0,50500538,1,5,-,3,0,4,0,7500
0,Buat ulang Jas Pengumpul Berlian Anda,2,recipe-icon-539,539,5,"326,1;401,2",Lv 5 Diamond Gather Coat Recasting: Pengecoran Ulang Mantel Pengumpul Berlian Lv 5,"326,2,1,4426;326,3,1,2950;326,4,1,1967;326,5,1,655",1,0,50500539,1,5,-,3,0,4,0,7500
0,Buat ulang Celana Pejuang Berlian Anda,2,recipe-icon-540,540,5,"343,1;410,1;407,1",Lv 5 Diamond Fighter Pants Recasting: Pengecoran Ulang Celana Tempur Berlian Lv 5,"343,2,1,4426;343,3,1,2950;343,4,1,1967;343,5,1,655",1,0,50500540,1,5,-,2,0,4,0,7500
0,Buat ulang Sepatu Pejuang Berlian Anda,2,recipe-icon-541,541,5,"344,1;410,1;407,1",Lv 5 Diamond Fighter Shoes Recasting: Pengecoran Ulang Sepatu Tempur Berlian Lv 5,"344,2,1,4426;344,3,1,2950;344,4,1,1967;344,5,1,655",1,0,50500541,1,5,-,2,0,4,0,7500
0,Buat ulang Sarung Tangan Pengumpul Berlian Anda,2,recipe-icon-542,542,5,"327,1;401,2",Lv 5 Diamond Gather Glove Recasting: Pengecoran Ulang Sarung Tangan Pengumpul Berlian Lv 5,"327,2,1,4426;327,3,1,2950;327,4,1,1967;327,5,1,655",1,0,50500542,1,5,-,3,0,4,0,7500
0,Buat ulang Topi Pengumpul Berlian Anda,2,recipe-icon-543,543,5,"325,1;401,2",Lv 5 Diamond Gather Hat Recasting: Pengecoran Ulang Topi Pengumpul Berlian Lv 5,"325,2,1,4426;325,3,1,2950;325,4,1,1967;325,5,1,655",1,0,50500543,1,5,-,3,0,4,0,7500
0,Buat ulang Celana Pengumpul Berlian Anda,2,recipe-icon-544,544,5,"328,1;401,2",Lv 5 Diamond Gather Pants Recasting: Pengecoran Ulang Celana Pengumpul Berlian Lv 5,"328,2,1,4426;328,3,1,2950;328,4,1,1967;328,5,1,655",1,0,50500544,1,5,-,3,0,4,0,7500
0,Buat ulang Jas Petani Berlian Anda,2,recipe-icon-545,545,5,"356,1;404,2",Lv 5 Diamond Farmer Coat Recasting: Pengecoran Ulang Mantel Petani Berlian Lv 5,"356,2,1,4426;356,3,1,2950;356,4,1,1967;356,5,1,655",1,0,50500545,1,5,-,1,0,4,0,7500
0,Recast Diamond Bow Anda,2,recipe-icon-546,546,5,"451,1;410,1;407,1",Lv 5 Diamond Bow Recasting: Pengecoran Ulang Busur Berlian Lv 5,"451,2,1,4426;451,3,1,2950;451,4,1,1967;451,5,1,655",1,0,50500546,1,5,-,2,0,4,0,7500
0,Recast Diamond Brush Anda,2,recipe-icon-547,547,5,"457,1;404,2",Lv 5 Diamond Brush Recasting: Pengecoran Ulang Sikat Berlian Lv 5,"457,2,1,4426;457,3,1,2950;457,4,1,1967;457,5,1,655",1,0,50500547,1,5,-,1,0,4,0,7500
0,Buat ulang Sarung Tangan Petani Berlian Anda,2,recipe-icon-548,548,5,"357,1;404,2",Lv 5 Diamond Farmer Glove Recasting: Pengecoran Ulang Sarung Tangan Petani Berlian Lv 5,"357,2,1,4426;357,3,1,2950;357,4,1,1967;357,5,1,655",1,0,50500548,1,5,-,1,0,4,0,7500
0,Buat ulang Topi Petani Berlian Anda,2,recipe-icon-549,549,5,"355,1;404,2",Lv 5 Diamond Farmer Hat Recasting: Pengecoran Ulang Topi Petani Berlian Lv 5,"355,2,1,4426;355,3,1,2950;355,4,1,1967;355,5,1,655",1,0,50500549,1,5,-,1,0,4,0,7500
0,Buat ulang Ketel Berlian Anda,2,recipe-icon-551,551,5,"310,1;404,2",Lv 5 Diamond Kettle Recasting: Pengecoran Ulang Teko Berlian Lv 5,"310,2,1,4426;310,3,1,2950;310,4,1,1967;310,5,1,655",1,0,50500551,1,5,-,1,0,4,0,7500
0,Buat ulang Beliung Berlian Anda,2,recipe-icon-552,552,5,"307,1;401,2",Lv 5 Diamond Pickaxe Recasting: Pengecoran Ulang Beliung Berlian Lv 5,"307,2,1,4426;307,3,1,2950;307,4,1,1967;307,5,1,655",1,0,50500552,1,5,-,3,0,4,0,7500
0,Buat ulang Kuas Cahaya Bintang Anda,2,recipe-icon-553,553,6,"458,1;405,2",Lv 6 Starlight Brush Recasting: Pengecoran Ulang Sikat Cahaya Bintang Lv 6,"458,2,1,4426;458,3,1,2950;458,4,1,1967;458,5,1,655",1,0,50400553,1,5,-,1,0,4,0,10000
0,Buat ulang Sarung Tangan Pengumpul Bintang Anda,2,recipe-icon-554,554,6,"332,1;402,2",Lv 6 Star Gather Glove Recasting: Pengecoran Ulang Sarung Tangan Pengumpul Cahaya Bintang Lv 6,"332,2,1,4426;332,3,1,2950;332,4,1,1967;332,5,1,655",1,0,50400554,1,5,-,3,0,4,0,10000
0,Buat ulang Sepatu Pejuang Bintang Anda,2,recipe-icon-555,555,6,"349,1;411,1;408,1",Lv 6 Star Fighter Shoes Recasting: Pengecoran Ulang Sepatu Tempur Cahaya Bintang Lv 6,"349,2,1,4426;349,3,1,2950;349,4,1,1967;349,5,1,655",1,0,50400555,1,5,-,2,0,4,0,10000
0,Buat ulang Jas Pengumpul Bintang Anda,2,recipe-icon-556,556,6,"331,1;402,2",Lv 6 Star Gather Coat Recasting: Pengecoran Ulang Mantel Pengumpul Cahaya Bintang Lv 6,"331,2,1,4426;331,3,1,2950;331,4,1,1967;331,5,1,655",1,0,50400556,1,5,-,3,0,4,0,10000
0,Buat ulang Topi Pengumpul Bintang Anda,2,recipe-icon-557,557,6,"330,1;402,2",Lv 6 Star Gather Hat Recasting: Pengecoran Ulang Topi Pengumpul Cahaya Bintang Lv 6,"330,2,1,4426;330,3,1,2950;330,4,1,1967;330,5,1,655",1,0,50400557,1,5,-,3,0,4,0,10000
0,Buat ulang Celana Pengumpul Bintang Anda,2,recipe-icon-558,558,6,"333,1;402,2",Lv 6 Star Gather Pants Recasting: Pengecoran Ulang Celana Pengumpul Cahaya Bintang Lv 6,"333,2,1,4426;333,3,1,2950;333,4,1,1967;333,5,1,655",1,0,50400558,1,5,-,3,0,4,0,10000
0,Buat ulang Busur Cahaya Bintang Anda,2,recipe-icon-559,559,6,"452,1;411,1;408,1",Lv 6 Starlight Bow Recasting: Pengecoran Ulang Busur Cahaya Bintang Lv 6,"452,2,1,4426;452,3,1,2950;452,4,1,1967;452,5,1,655",1,0,50400559,1,5,-,2,0,4,0,10000
0,Buat ulang Celana Petani Bintang Anda,2,recipe-icon-560,560,6,"363,1;405,2",Lv 6 Star Farmer Pants Recasting: Pengecoran Ulang Celana Petani Cahaya Bintang Lv 6,"363,2,1,4426;363,3,1,2950;363,4,1,1967;363,5,1,655",1,0,50400560,1,5,-,1,0,4,0,10000
0,Buat ulang Pedang Bintang Anda,2,recipe-icon-561,561,6,"319,1;411,1;408,1",Lv 6 Star Sword Recasting: Pengecoran Ulang Pedang Cahaya Bintang Lv 6,"319,2,1,4426;319,3,1,2950;319,4,1,1967;319,5,1,655",1,0,50400561,1,5,-,2,0,4,0,10000
0,Buat ulang Sepatu Pengumpul Bintang Anda,2,recipe-icon-562,562,6,"334,1;402,2",Lv 6 Bintang Kumpulkan Sepatu Mencetak Ulang,"334,2,1,4426;334,3,1,2950;334,4,1,1967;334,5,1,655",1,0,50400562,1,5,-,3,0,4,0,10000
0,Buat ulang Ketel Bintang Anda,2,recipe-icon-563,563,6,"316,1;405,2",Lv 6 Bintang Kettle Mencetak Ulang,"316,2,1,4426;316,3,1,2950;316,4,1,1967;316,5,1,655",1,0,50400563,1,5,-,1,0,4,0,10000
0,Buat ulang Cangkul Bintang Anda,2,recipe-icon-564,564,6,"311,1;405,2",Lv 6 Bintang Cangkul Mencetak Ulang,"311,2,1,4426;311,3,1,2950;311,4,1,1967;311,5,1,655",1,0,50400564,1,5,-,1,0,4,0,10000
0,Buat ulang Beliung Bintang Anda,2,recipe-icon-565,565,6,"313,1;402,2",Lv 6 Bintang Beliung Mencetak Ulang,"313,2,1,4426;313,3,1,2950;313,4,1,1967;313,5,1,655",1,0,50400565,1,5,-,3,0,4,0,10000
0,Buat ulang Sabit Bintang Anda,2,recipe-icon-566,566,6,"315,1;402,2",Lv 6 Bintang Sabit Mencetak Ulang,"315,2,1,4426;315,3,1,2950;315,4,1,1967;315,5,1,655",1,0,50400566,1,5,-,3,0,4,0,10000
0,Buat ulang Sepatu Petani Bintang Anda,2,recipe-icon-568,568,6,"364,1;405,2",Lv 6 Bintang Kumpulan Sepatu Petani Mencetak Ulang,"364,2,1,4426;364,3,1,2950;364,4,1,1967;364,5,1,655",1,0,50400568,1,5,-,1,0,4,0,10000
0,Buat ulang Sarung Tangan Pejuang Bintang Anda,2,recipe-icon-569,569,6,"347,1;411,1;408,1",Lv 6 Bintang Sarung Tangan Petarung Mencetak Ulang,"347,2,1,4426;347,3,1,2950;347,4,1,1967;347,5,1,655",1,0,50400569,1,5,-,2,0,4,0,10000
0,Buat ulang Jas Pejuang Bintang Anda,2,recipe-icon-570,570,6,"346,1;411,1;408,1",Lv 6 Bintang Jas Petarung Mencetak Ulang,"346,2,1,4426;346,3,1,2950;346,4,1,1967;346,5,1,655",1,0,50400570,1,5,-,2,0,4,0,10000
0,Buat ulang Topi Pejuang Bintang Anda,2,recipe-icon-571,571,6,"345,1;411,1;408,1",Lv 6 Bintang Topi Petarung Mencetak Ulang,"345,2,1,4426;345,3,1,2950;345,4,1,1967;345,5,1,655",1,0,50400571,1,5,-,2,0,4,0,10000
0,Buat ulang Celana Pejuang Bintang Anda,2,recipe-icon-572,572,6,"348,1;411,1;408,1",Lv 6 Bintang Celana Petarung Mencetak Ulang,"348,2,1,4426;348,3,1,2950;348,4,1,1967;348,5,1,655",1,0,50400572,1,5,-,2,0,4,0,10000
0,Buat ulang Topi Petani Bintang Anda,2,recipe-icon-573,573,6,"360,1;405,2",Lv 6 Bintang Topi Petani Mencetak Ulang,"360,2,1,4426;360,3,1,2950;360,4,1,1967;360,5,1,655",1,0,50400573,1,5,-,1,0,4,0,10000
0,Buat ulang Jas Petani Bintang Anda,2,recipe-icon-574,574,6,"361,1;405,2",Lv 6 Bintang Jas Petani Mencetak Ulang,"361,2,1,4426;361,3,1,2950;361,4,1,1967;361,5,1,655",1,0,50400574,1,5,-,1,0,4,0,10000
0,Buat ulang Sarung Tangan Petani Bintang Anda,2,recipe-icon-575,575,6,"362,1;405,2",Lv 6 Bintang Sarung Tangan Petani Mencetak Ulang,"362,2,1,4426;362,3,1,2950;362,4,1,1967;362,5,1,655",1,0,50400575,1,5,-,1,0,4,0,10000
0,Recast Golden Sickle Anda,2,recipe-icon-576,576,4,"303,1;218,2",Lv 4 Sabit Emas Mencetak Ulang,"303,2,1,4736;303,3,1,3157;303,4,1,2105",1,0,50600576,1,5,-,3,0,4,0,5000
0,Buat ulang Sabit Berlian Anda,2,recipe-icon-577,577,5,"309,1;401,2",Lv 5 Sabit Berlian Mencetak Ulang,"309,2,1,4426;309,3,1,2950;309,4,1,1967;309,5,1,655",1,0,50500577,1,5,-,3,0,4,0,7500
0,Buat ulang Kapak Bintang Anda,2,recipe-icon-578,578,6,"312,1;402,2",Lv 6 Bintang Kapak Mencetak Ulang,"312,2,1,4426;312,3,1,2950;312,4,1,1967;312,5,1,655",1,0,50400578,1,5,-,3,0,4,0,10000
0,Recast Metal Bow Anda,2,recipe-icon-579,579,2,"288,1;213,1;210,1",Lv 2 Busur Logam Mencetak Ulang,"288,2,1,10000",1,0,10800579,1,5,-,2,0,4,0,0
0,Recast Lucky Hard Hat Anda,2,recipe-icon-580,580,3,"100,1;208,2",Lv 3 Topi Keras Beruntung Mencetak Ulang,"100,2,1,6000;100,3,1,4000",1,0,50700580,1,5,-,1,0,4,0,0
0,Recast Golden Sword Anda,2,recipe-icon-581,581,4,"317,1;215,1;212,1",Lv 4 Pedang Emas Mencetak Ulang,"317,2,1,4736;317,3,1,3157;317,4,1,2105",1,0,50600581,1,5,-,2,0,4,0,5000
0,Buat ulang Pedang Berlian Anda,2,recipe-icon-582,582,5,"318,1;410,1;407,1",Lv 5 Pedang Berlian Mencetak Ulang,"318,2,1,4426;318,3,1,2950;318,4,1,1967;318,5,1,655",1,0,50500582,1,5,-,2,0,4,0,7500
0,Buat ulang Palu Cahaya Bintang Anda,2,recipe-icon-583,583,6,"446,1;411,1;408,1",Lv 6 Bintang Palu Cahaya Mencetak Ulang,"446,2,1,4426;446,3,1,2950;446,4,1,1967;446,5,1,655",1,0,50400583,1,5,-,2,0,4,0,10000
2,Resep Slime Energi Pengumpulan Lv 2,2,recipe-icon-585,585,2,"482,1;33,4;34,4;35,4",Resep Slime Energi Kombat Lv 2,"483,1,1,10000",4,0,20800585,1,3,-,2,0,4,0,0
0,Resep Slime Energi Tempur Lv 6,2,recipe-icon-586,586,6,"486,1;400,4;399,4;398,4",Resep Slime Energi Pertanian Lv 6,"487,1,1,10000",4,0,20400586,1,3,-,1,0,4,0,0
0,Resep Slime Energi Tempur Lv 5,2,recipe-icon-587,587,5,"485,1;386,4;387,4;388,4",Resep Slime Energi Pertanian Lv 5,"486,1,1,10000",4,0,20500587,1,3,-,1,0,4,0,0
1,Resep Slime Energi Pengumpulan Lv 1,2,recipe-icon-588,588,1,"30,4;31,4;32,4",Resep Slime Energi Kombat Lv 1,"482,1,1,10000",4,0,20900588,1,3,-,2,0,4,0,0
5,Resep Slime Energi Pengumpulan Lv 5,2,recipe-icon-589,589,5,"485,1;370,4;368,4;369,4",Resep Slime Energi Kombat Lv 5,"486,1,1,10000",4,0,20500589,1,3,-,2,0,4,0,0
4,Resep Slime Energi Pengumpulan Lv 4,2,recipe-icon-590,590,4,"484,1;365,4;366,4;367,4",Resep Slime Energi Kombat Lv 4,"485,1,1,10000",4,0,20600590,1,3,-,2,0,4,0,0
0,Resep Slime Energi Tempur Lv 1,2,recipe-icon-591,591,1,"177,4;178,4;179,4",Resep Slime Energi Pertanian Lv 1,"482,1,1,10000",4,0,20900591,1,3,-,1,0,4,0,0
3,Resep Slime Energi Pengumpulan Lv 3,2,recipe-icon-592,592,3,"483,1;38,4;37,4;36,4",Resep Slime Energi Kombat Lv 3,"484,1,1,10000",4,0,20700592,1,3,-,2,0,4,0,0
0,Resep Slime Energi Tempur Lv 2,2,recipe-icon-593,593,2,"482,1;180,4;181,4;182,4",Resep Slime Energi Pertanian Lv 2,"483,1,1,10000",4,0,20800593,1,3,-,1,0,4,0,0
0,Resep Slime Energi Tempur Lv 4,2,recipe-icon-594,594,4,"484,1;392,4;394,4;393,4",Resep Slime Energi Pertanian Lv 4,"485,1,1,10000",4,0,20600594,1,3,-,1,0,4,0,0
6,Resep Slime Energi Pengumpulan Lv 6,2,recipe-icon-595,595,6,"486,1;371,4;373,4;372,4",Resep Slime Energi Kombat Lv 6,"487,1,1,10000",4,0,20400595,1,3,-,2,0,4,0,0
0,Resep Slime Energi Tempur Lv 3,2,recipe-icon-596,596,3,"483,1;183,4;185,4;184,4",Resep Slime Energi Pertanian Lv 3,"484,1,1,10000",4,0,20700596,1,3,-,1,0,4,0,0
0,Resep Slime Energi Tempur Lv 1,2,recipe-icon-597,597,1,"70,4;72,4;71,4",Resep Slime Energi Pertanian Lv 1,"482,1,1,10000",4,0,20900597,1,3,-,1,0,4,0,0
0,Resep Slime Energi Tempur Lv 2,2,recipe-icon-598,598,2,"482,1;73,4;74,4;75,4",Resep Slime Energi Pertanian Lv 2,"483,1,1,10000",4,0,20800598,1,3,-,1,0,4,0,0
0,Resep Slime Energi Tempur Lv 3,2,recipe-icon-599,599,3,"483,1;77,4;76,4;78,4",Resep Slime Energi Pertanian Lv 3,"484,1,1,10000",4,0,20700599,1,3,-,1,0,4,0,0
0,Resep Slime Energi Tempur Lv 4,2,recipe-icon-600,600,4,"484,1;383,4;384,4;385,4",Resep Slime Energi Pertanian Lv 4,"485,1,1,10000",4,0,20600600,1,3,-,1,0,4,0,0
0,Resep Slime Energi Tempur Lv 5,2,recipe-icon-601,601,5,"485,1;396,4;395,4;397,4",Resep Slime Energi Pertanian Lv 5,"486,1,1,10000",4,0,20500601,1,3,-,1,0,4,0,0
0,Resep Slime Energi Tempur Lv 6,2,recipe-icon-602,602,6,"486,1;389,4;391,4;390,4",Resep Slime Energi Pertanian Lv 6,"487,1,1,10000",4,0,20400602,1,3,-,1,0,4,0,0
0, Anda dapat menerima hadiah berikut:300 LUAG 20%200 LUAG 30%100 LUAG 50%,2,recipe-icon-604,604,0,"480,5",Pertukaran LUAG,"478,1,6,6250;478,1,10,3750;478,1,20,",4,0,51000604,1,3,80,0,0,4,0,80000
1,Resep Ramuan Restorasi Energi Lv 1,2,recipe-icon-605,605,1,"482,1;479,1",Resep Ramuan Restorasi Energi Lv 1,"709,1,3,5000;709,1,4,5000",3,0,50900605,1,3,-,3,0,4,0,0
2,Resep Ramuan Restorasi Energi Lv 2,2,recipe-icon-606,606,2,"483,1;479,1",Resep Ramuan Restorasi Energi Lv 2,"710,1,3,10000",3,0,40800606,1,3,-,3,0,4,0,0
