classifyLevel-int,desc-string,displayType-int,icon-string,id-int,level-int,matItemId-int[][],name-string,productId-int[][],proficiency-int,recipesSort-int,sourceText-int,timeCost-int,type-int,unlockCondition-int,unlockType-int,useDitamin-int,useMELD-int
0,Receta de Pantalones de Luchador de Diamante,2,recipe-icon-296,296,5,"404,2;408,1;411,1",Receta de Pantalones de Luchador de Diamante,"343,1,1,3838;343,2,1,2559;343,3,1,1706;343,4,1,1137;343,5,1,379;280,5,1,379",0,2,1,90,2,0,4,0,15
0,Receta de Zapatos de Luchador de Diamante,2,recipe-icon-297,297,5,"404,2;408,1;411,1",Receta de Zapatos de Luchador de Diamante,"344,1,1,3838;344,2,1,2559;344,3,1,1706;344,4,1,1137;344,5,1,379;281,5,1,379",0,2,1,90,2,0,4,0,15
0,Receta de Guadaña de Diamante,2,recipe-icon-298,298,5,"407,1;410,1;402,2",Receta de Guadaña de Diamante,"309,1,1,3990;309,2,1,2660;309,3,1,1773;309,4,1,1182;309,5,1,394",0,3,1,90,3,0,4,0,15
0,Receta de Hacha de Diamante,2,recipe-icon-299,299,5,"407,1;410,1;402,2",Receta de Hacha de Diamante,"306,1,1,3990;306,2,1,2660;306,3,1,1773;306,4,1,1182;306,5,1,394",0,3,1,90,3,0,4,0,15
0,Receta de Pico de Diamante,2,recipe-icon-300,300,5,"407,1;410,1;402,2",Receta de Pico de Diamante,"307,1,1,3990;307,2,1,2660;307,3,1,1773;307,4,1,1182;307,5,1,394",0,3,1,90,3,0,4,0,15
0,Receta de Sombrero de Recolector de Diamante,2,recipe-icon-301,301,5,"407,1;410,1;402,2",Receta de Sombrero de Recolector de Diamante,"325,1,1,3838;325,2,1,2559;325,3,1,1706;325,4,1,1137;325,5,1,379;277,5,1,379",0,2,1,90,3,0,4,0,15
0,Receta de Abrigo de Recolector de Diamante,2,recipe-icon-302,302,5,"407,1;410,1;402,2",Receta de Abrigo de Recolector de Diamante,"326,1,1,3838;326,2,1,2559;326,3,1,1706;326,4,1,1137;326,5,1,379;278,5,1,379",0,2,1,90,3,0,4,0,15
0,Receta de Guantes de Recolector de Diamante,2,recipe-icon-303,303,5,"407,1;410,1;402,2",Receta de Guantes de Recolector de Diamante,"327,1,1,3838;327,2,1,2559;327,3,1,1706;327,4,1,1137;327,5,1,379;279,5,1,379",0,2,1,90,3,0,4,0,15
0,Receta de Pantalones de Recolector de Diamante,2,recipe-icon-304,304,5,"407,1;410,1;402,2",Receta de Pantalones de Recolector de Diamante,"328,1,1,3838;328,2,1,2559;328,3,1,1706;328,4,1,1137;328,5,1,379;280,5,1,379",0,2,1,90,3,0,4,0,15
0,Receta de Zapatos de Recolector de Diamante,2,recipe-icon-305,305,5,"407,1;410,1;402,2",Receta de Zapatos de Recolector de Diamante,"329,1,1,3838;329,2,1,2559;329,3,1,1706;329,4,1,1137;329,5,1,379;281,5,1,379",0,2,1,90,3,0,4,0,15
0,Receta de Azada de Diamante,2,recipe-icon-306,306,5,"401,2;405,2",Receta de Azada de Diamante,"305,1,1,3990;305,2,1,2660;305,3,1,1773;305,4,1,1182;305,5,1,394",0,3,1,90,1,0,4,0,15
0,Receta de Sombrero de Granjero de Diamante,2,recipe-icon-308,308,5,"401,2;405,2",Receta de Sombrero de Granjero de Diamante,"355,1,1,3838;355,2,1,2559;355,3,1,1706;355,4,1,1137;355,5,1,379;277,5,1,379",0,2,1,90,1,0,4,0,15
0,Receta de Abrigo de Granjero de Diamante,2,recipe-icon-309,309,5,"401,2;405,2",Receta de Abrigo de Granjero de Diamante,"356,1,1,3838;356,2,1,2559;356,3,1,1706;356,4,1,1137;356,5,1,379;279,5,1,379",0,2,1,90,1,0,4,0,15
0,Receta de Guantes de Granjero de Diamante,2,recipe-icon-310,310,5,"401,2;405,2",Receta de Guantes de Granjero de Diamante,"357,1,1,3838;357,2,1,2559;357,3,1,1706;357,4,1,1137;357,5,1,379;278,5,1,379",0,2,1,90,1,0,4,0,15
0,Vacío,2,recipe-icon-311,311,5,"401,2;405,2",Receta de Pantalones de Granjero de Diamante,"358,1,1,3838;358,2,1,2559;358,3,1,1706;358,4,1,1137;358,5,1,379;280,5,1,379",0,2,1,90,1,0,4,0,15
0,Vacío,2,recipe-icon-312,312,5,"401,2;405,2",Receta de Zapatos de Granjero de Diamante,"359,1,1,3838;359,2,1,2559;359,3,1,1706;359,4,1,1137;359,5,1,379;281,5,1,379",0,2,1,90,1,0,4,0,15
0,Vacío,2,recipe-icon-313,313,6,"405,2;409,1;412,1",Receta de Espada Estelar,"319,1,1,3990;319,2,1,2660;319,3,1,1773;319,4,1,1182;319,5,1,394",0,3,1,270,2,0,4,0,20
0,Vacío,2,recipe-icon-314,314,6,"405,2;409,1;412,1",Receta de Sombrero de Luchador Estelar,"345,1,1,3838;345,2,1,2559;345,3,1,1706;345,4,1,1137;345,5,1,379;471,5,1,379",0,2,1,270,2,0,4,0,20
0,Vacío,2,recipe-icon-315,315,6,"405,2;409,1;412,1",Receta de Abrigo de Luchador Estelar,"346,1,1,3838;346,2,1,2559;346,3,1,1706;346,4,1,1137;346,5,1,379;472,5,1,379",0,2,1,270,2,0,4,0,20
0,Vacío,2,recipe-icon-316,316,6,"405,2;409,1;412,1",Receta de Guantes de Luchador Estelar,"347,1,1,3838;347,2,1,2559;347,3,1,1706;347,4,1,1137;347,5,1,379;473,5,1,379",0,2,1,270,2,0,4,0,20
0,Vacío,2,recipe-icon-317,317,6,"405,2;409,1;412,1",Receta de Pantalones de Luchador Estelar,"348,1,1,3838;348,2,1,2559;348,3,1,1706;348,4,1,1137;348,5,1,379;474,5,1,379",0,2,1,270,2,0,4,0,20
0,Vacío,2,recipe-icon-318,318,6,"405,2;409,1;412,1", Receta de zapatos de luchador estelar,"349,1,1,3838;349,2,1,2559;349,3,1,1706;349,4,1,1137;349,5,1,379;475,5,1,379",0,2,1,270,2,0,4,0,20
0,Vacío,2,recipe-icon-319,319,6,"408,1;411,1;403,2", Receta de hoz estelar,"315,1,1,3990;315,2,1,2660;315,3,1,1773;315,4,1,1182;315,5,1,394",0,3,1,270,3,0,4,0,20
0,Vacío,2,recipe-icon-320,320,6,"408,1;411,1;403,2", Receta de hacha estelar,"312,1,1,3990;312,2,1,2660;312,3,1,1773;312,4,1,1182;312,5,1,394",0,3,1,270,3,0,4,0,20
0,Vacío,2,recipe-icon-321,321,6,"408,1;411,1;403,2", Receta de pico estelar,"313,1,1,3990;313,2,1,2660;313,3,1,1773;313,4,1,1182;313,5,1,394",0,3,1,270,3,0,4,0,20
0,Vacío,2,recipe-icon-323,323,6,"408,1;411,1;403,2", Receta de abrigo de recolección estelar,"331,1,1,3838;331,2,1,2559;331,3,1,1706;331,4,1,1137;331,5,1,379;472,5,1,379",0,2,1,270,3,0,4,0,20
0,Vacío,2,recipe-icon-322,322,6,"408,1;411,1;403,2", Receta de sombrero de recolección estelar,"330,1,1,3838;330,2,1,2559;330,3,1,1706;330,4,1,1137;330,5,1,379;471,5,1,379",0,2,1,270,3,0,4,0,20
0,Vacío,2,recipe-icon-324,324,6,"408,1;411,1;403,2", Receta de guantes de recolección estelar,"332,1,1,3838;332,2,1,2559;332,3,1,1706;332,4,1,1137;332,5,1,379;473,5,1,379",0,2,1,270,3,0,4,0,20
0,Vacío,2,recipe-icon-325,325,6,"408,1;411,1;403,2", Receta de pantalones de recolección estelar,"333,1,1,3838;333,2,1,2559;333,3,1,1706;333,4,1,1137;333,5,1,379;474,5,1,379",0,2,1,270,3,0,4,0,20
0,Vacío,2,recipe-icon-327,327,6,"402,2;406,2", Receta de azada estelar,"311,1,1,3990;311,2,1,2660;311,3,1,1773;311,4,1,1182;311,5,1,394",0,3,1,270,1,0,4,0,20
0,Vacío,2,recipe-icon-326,326,6,"408,1;411,1;403,2", Receta de zapatos de recolección estelar,"334,1,1,3838;334,2,1,2559;334,3,1,1706;334,4,1,1137;334,5,1,379;475,5,1,379",0,2,1,270,3,0,4,0,20
0,Vacío,2,recipe-icon-330,330,6,"402,2;406,2", Receta de abrigo de granjero estelar,"361,1,1,3838;361,2,1,2559;361,3,1,1706;361,4,1,1137;361,5,1,379;473,5,1,379",0,2,1,270,1,0,4,0,20
0,Vacío,2,recipe-icon-329,329,6,"402,2;406,2", Receta de sombrero de granjero estelar,"360,1,1,3838;360,2,1,2559;360,3,1,1706;360,4,1,1137;360,5,1,379;471,5,1,379",0,2,1,270,1,0,4,0,20
0,Vacío,2,recipe-icon-331,331,6,"402,2;406,2", Receta de guantes de granjero estelar,"362,1,1,3838;362,2,1,2559;362,3,1,1706;362,4,1,1137;362,5,1,379;472,5,1,379",0,2,1,270,1,0,4,0,20
0,Vacío,2,recipe-icon-332,332,6,"402,2;406,2", Receta de pantalones de granjero estelar,"363,1,1,3838;363,2,1,2559;363,3,1,1706;363,4,1,1137;363,5,1,379;474,5,1,379",0,2,1,270,1,0,4,0,20
0,Vacío,2,recipe-icon-333,333,6,"402,2;406,2", Receta de zapatos de granjero estelar,"364,1,1,3838;364,2,1,2559;364,3,1,1706;364,4,1,1137;364,5,1,379;475,5,1,379",0,2,1,270,1,0,4,0,20
0,Vacío,2,recipe-icon-334,334,4,"383,5;384,5;385,5;212,2", Receta de esencia de plantación agrícola de nivel 4,"407,1,1,10000",0,1,1,30,1,0,4,0,0
0,Vacío,2,recipe-icon-335,335,5,"386,5;387,5;388,5;407,2", Receta de esencia de plantación agrícola de nivel 5,"408,1,1,10000",0,1,1,90,1,0,4,0,0
0,Vacío,2,recipe-icon-336,336,6,"389,5;390,5;391,5;408,2", Receta de esencia de plantación agrícola de nivel 6,"409,1,1,10000",0,1,1,270,1,0,4,0,0
0,Vacío,2,recipe-icon-337,337,4,"392,5;393,5;394,5;215,2", Receta de esencia de ganadería agrícola de nivel 4,"410,1,1,10000",0,1,1,30,1,0,4,0,0
0,Vacío,2,recipe-icon-338,338,5,"395,5;396,5;397,5;410,2", Receta de esencia de ganadería agrícola de nivel 5,"411,1,1,10000",0,1,1,90,1,0,4,0,0
0,Vacío,2,recipe-icon-339,339,6,"398,5;399,5;400,5;411,2", Receta de esencia de ganadería agrícola de nivel 6,"412,1,1,10000",0,1,1,270,1,0,4,0,0
0,Vacío,2,recipe-icon-340,340,4,"365,5;366,5;367,5;218,2", Receta de esencia de combate de nivel 4,"401,1,1,10000",0,1,1,30,2,0,4,0,0
0,Vacío,2,recipe-icon-341,341,5,"368,5;370,5;369,5;401,2", Receta de esencia de combate de nivel 5,"402,1,1,10000",0,1,1,90,2,0,4,0,0
0,Vacío,2,recipe-icon-342,342,6,"371,5;372,5;373,5;402,2", Receta de esencia de combate de nivel 6,"403,1,1,10000",0,1,1,270,2,0,4,0,0
0,Vacío,2,recipe-icon-343,343,4,"375,5;376,5;374,5;209,2", Receta de esencia de recolección de nivel 4,"404,1,1,10000",0,1,1,30,3,0,4,0,0
0,Vacío,2,recipe-icon-345,345,6,"380,5;381,5;382,5;405,2", Receta de esencia de recolección de nivel 6,"406,1,1,10000",0,1,1,270,3,0,4,0,0
0,Vacío,2,recipe-icon-344,344,5,"377,5;378,5;379,5;404,2", Receta de esencia de recolección de nivel 5,"405,1,1,10000",0,1,1,90,3,0,4,0,0
0,Vacío,2,recipe-icon-347,347,5,"377,2;378,2;379,2", Recetas de poción de nivel 5,"429,1,1,1666;430,1,1,1666;431,1,1,1666;432,1,1,1666;433,1,1,1666;434,1,1,1666",0,1,1,90,3,0,4,0,0
0,Vacío,2,recipe-icon-346,346,4,"374,2;375,2;376,2", Recetas de poción de nivel 4,"422,1,1,1666;423,1,1,1666;424,1,1,1666;425,1,1,1666;426,1,1,1666;427,1,1,1666",0,1,1,30,3,0,4,0,0
0,Vacío,2,recipe-icon-348,348,6,"380,2;381,2;382,2", Recetas de poción de nivel 6,"435,1,1,1666;436,1,1,1666;437,1,1,1666;438,1,1,1666;439,1,1,1666;440,1,1,1666",0,1,1,270,3,0,4,0,0
0,Vacío,2,recipe-icon-364,364,1,"210,1;213,1",Receta de martillo de cobre de nivel 1,"441,1,1,10000",0,3,1,10,2,0,4,0,0
0,Vacío,2,recipe-icon-365,365,2,"207,2;211,1;214,1",Receta de martillo de hierro de nivel 2,"442,1,1,6000;442,2,1,4000",0,3,1,10,2,0,4,0,0
0,Vacío,2,recipe-icon-367,367,4,"209,2;407,1;410,1",Receta de martillo dorado de nivel 4,"444,1,1,4153;444,2,1,2769;444,3,1,1846;444,4,1,1230",0,3,1,30,2,0,4,0,10
0,Vacío,2,recipe-icon-366,366,3,"208,2;212,1;215,1",Receta de martillo de cristal de nivel 3,"443,1,1,4736;443,2,1,3157;443,3,1,2105",0,3,1,10,2,0,4,0,5
0,Vacío,2,recipe-icon-368,368,5,"404,2;408,1;411,1",Receta de martillo de diamante de nivel 5,"445,1,1,3990;445,2,1,2660;445,3,1,1773;445,4,1,1182;445,5,1,394",0,3,1,90,2,0,4,0,15
0,Vacío,2,recipe-icon-369,369,6,"405,2;409,1;412,1",Receta de martillo de luz estelar de nivel 6,"446,1,1,3990;446,2,1,2660;446,3,1,1773;446,4,1,1182;446,5,1,394",0,3,1,270,2,0,4,0,20
0,Vacío,2,recipe-icon-370,370,1,"210,1;213,1",Receta de arco de piedra de nivel 1,"287,1,1,10000",0,3,1,10,2,0,4,0,0
0,Vacío,2,recipe-icon-371,371,2,"207,2;211,1;214,1",Receta de arco de metal de nivel 2,"288,1,1,6000;288,2,1,4000",0,3,1,10,2,0,4,0,0
0,Vacío,2,recipe-icon-372,372,3,"208,2;212,1;215,1",Receta de arco de cristal de nivel 3,"289,1,1,4736;289,2,1,3157;289,3,1,2105",0,3,1,10,2,0,4,0,5
0,Vacío,2,recipe-icon-373,373,4,"209,2;407,1;410,1",Receta de arco dorado de nivel 4,"450,1,1,4153;450,2,1,2769;450,3,1,1846;450,4,1,1230",0,3,1,30,2,0,4,0,10
0,Vacío,2,recipe-icon-374,374,5,"404,2;408,1;411,1",Receta de arco de diamante de nivel 5,"451,1,1,3990;451,2,1,2660;451,3,1,1773;451,4,1,1182;451,5,1,394",0,3,1,90,2,0,4,0,15
0,Vacío,2,recipe-icon-375,375,6,"405,2;409,1;412,1",Receta de arco de luz estelar de nivel 6,"452,1,1,3990;452,2,1,2660;452,3,1,1773;452,4,1,1182;452,5,1,394",0,3,1,270,2,0,4,0,20
0,Vacío,2,recipe-icon-376,376,1,"207,2",Receta de cepillo de cobre de nivel 1,"453,1,1,10000",0,3,1,10,1,0,4,0,0
0,Vacío,2,recipe-icon-377,377,2,"216,2;208,2",Receta de cepillo de hierro de nivel 2,"454,1,1,6000;454,2,1,4000",0,3,1,10,1,0,4,0,0
0,Vacío,2,recipe-icon-378,378,3,"217,2;209,2",Receta de cepillo de cristal de nivel 3,"455,1,1,4736;455,2,1,3157;455,3,1,2105",0,3,1,10,1,0,4,0,5
0,Vacío,2,recipe-icon-379,379,4,"218,2;404,2",Receta de cepillo dorado de nivel 4,"456,1,1,4153;456,2,1,2769;456,3,1,1846;456,4,1,1230",0,3,1,30,1,0,4,0,10
0,Vacío,2,recipe-icon-380,380,5,"401,2;405,2",Receta de cepillo de diamante de nivel 5,"457,1,1,3990;457,2,1,2660;457,3,1,1773;457,4,1,1182;457,5,1,394",0,3,1,90,1,0,4,0,15
0,Vacío,2,recipe-icon-381,381,6,"402,2;406,2",Receta de cepillo de luz estelar de nivel 6,"458,1,1,3990;458,2,1,2660;458,3,1,1773;458,4,1,1182;458,5,1,394",0,3,1,270,1,0,4,0,20
0,Vacío,2,recipe-icon-382,382,4,"375,5;374,10", Receta de poción de restauración de energía - Pequeña,"459,1,1,10000",0,1,1,10,3,0,4,0,0
0,Vacío,2,recipe-icon-383,383,5,"378,5;377,10",Poción de Restauración de Energía - Receta Mediana,"460,1,1,10000",0,1,1,10,3,0,4,0,0
0,Vacío,2,recipe-icon-384,384,6,"381,5;380,10",Poción de Restauración de Energía - Receta Grande,"461,1,1,10000",0,1,1,10,3,0,4,0,0
0,,0,recipe-icon-385,385,0,"365,8;366,8;367,8",,"464,1,3,10000",0,1,1,10,0,0,4,0,1
0,,0,recipe-icon-386,386,0,"368,3;369,3;370,3",,"464,1,12,10000",0,1,1,10,0,0,4,0,1
0,,0,recipe-icon-387,387,0,"371,1;372,1;373,1",,"464,1,18,10000",0,1,1,10,0,0,4,0,1
0,,0,recipe-icon-389,389,0,"463,1",,"465,1,12,10000",0,1,1,10,0,0,4,0,1
0,,0,recipe-icon-388,388,0,"462,1",,"465,1,3,10000",0,1,1,10,0,0,4,0,1
0,,0,recipe-icon-390,390,0,"207,2;216,2;210,1;213,1",,"466,1,3,10000",0,1,1,10,0,0,4,0,0
0,,0,recipe-icon-391,391,0,"208,2;217,2;211,1;214,1",,"466,1,12,10000",0,1,1,10,0,0,4,0,0
0,,0,recipe-icon-392,392,0,"209,2;218,2;212,1;212,1",,"466,1,27,10000",0,1,1,10,0,0,4,0,0
0,,0,recipe-icon-393,393,0,"70,10;71,10;72,10;177,10",,"466,1,3,10000",0,1,1,10,0,0,4,0,0
0,,0,recipe-icon-394,394,0,"73,10;74,10;75,10;180,10;181,10;182,10",,"466,1,12,10000",0,1,1,10,0,0,4,0,0
0,,0,recipe-icon-395,395,0,"76,10;77,10;78,10;183,10;184,10;185,10",,"466,1,27,10000",0,1,1,10,0,0,4,0,0
0,,0,recipe-icon-396,396,0,"209,2;218,2;212,1;215,1",,"467,1,1,10000",0,1,1,5,0,1,1,0,3
0,,0,recipe-icon-397,397,0,"469,2",,"468,1,5,6500;467,1,5,3500",0,1,1,5,0,1,1,0,0
0,,0,recipe-icon-398,398,0,"207,2;216,2;210,1;213,1",,"468,1,1,10000",0,1,1,5,0,1,1,0,1
0,,0,recipe-icon-404,404,0,"62,10;58,10",,"225,1,1,10000",0,1,1,10,3,1,1,0,0
