classifyLevel-int,desc-string,displayType-int,icon-string,id-int,level-int,matItemId-int[][],name-string,productId-int[][],proficiency-int,recipesSort-int,sourceText-int,timeCost-int,timesLimit-int,type-int,unlockCondition-int,unlockType-int,useDitamin-int,useToken-int
0,Resipi Beliung Berlian,2,recipe-icon-300,300,5,"407,1;410,1;402,2", Resipi Beliung Berlian ,"307,1,1,3990;307,2,1,2660;307,3,1,1773;307,4,1,1182;307,5,1,394",0,95300,1,90,-,3,0,4,0,15
0,Resipi Topi Kumpul Berlian,2,recipe-icon-301,301,5,"407,1;410,1;402,2", Resipi Topi Kumpul Berlian ,"325,1,1,3932;325,2,1,2621;325,3,1,1747;325,4,1,1165;325,5,1,388;277,5,1,145",0,95301,1,90,-,3,0,4,0,15
0,Resipi Kot Kumpul Berlian,2,recipe-icon-302,302,5,"407,1;410,1;402,2", Resipi Kot Kumpul Berlian ,"326,1,1,3932;326,2,1,2621;326,3,1,1747;326,4,1,1165;326,5,1,388;278,5,1,145",0,95302,1,90,-,3,0,4,0,15
0,Resipi Sarung Tangan Kumpul Berlian,2,recipe-icon-303,303,5,"407,1;410,1;402,2", Resipi Sarung Tangan Kumpul Berlian ,"327,1,1,3932;327,2,1,2621;327,3,1,1747;327,4,1,1165;327,5,1,388;473,5,1,145",0,95303,1,90,-,3,0,4,0,15
0,Resipi Seluar Kumpul Berlian,2,recipe-icon-304,304,5,"407,1;410,1;402,2", Resipi Seluar Kumpul Berlian ,"328,1,1,3932;328,2,1,2621;328,3,1,1747;328,4,1,1165;328,5,1,388;280,5,1,145",0,95304,1,90,-,3,0,4,0,15
0,Resipi Kasut Kumpul Berlian,2,recipe-icon-305,305,5,"407,1;410,1;402,2", Resipi Kasut Kumpul Berlian ,"329,1,1,3932;329,2,1,2621;329,3,1,1747;329,4,1,1165;329,5,1,388;281,5,1,145",0,95305,1,90,-,3,0,4,0,15
0,Resipi Cangkul Berlian,2,recipe-icon-306,306,5,"401,2;405,2", Resipi Cangkul Berlian ,"305,1,1,3990;305,2,1,2660;305,3,1,1773;305,4,1,1182;305,5,1,394",0,95306,1,90,-,1,0,4,0,15
0,Resipi Topi Petani Berlian,2,recipe-icon-308,308,5,"401,2;405,2", Resipi Topi Petani Berlian ,"355,1,1,3932;355,2,1,2621;355,3,1,1747;355,4,1,1165;355,5,1,388;277,5,1,145",0,95308,1,90,-,1,0,4,0,15
0,Resipi Kot Petani Berlian,2,recipe-icon-309,309,5,"401,2;405,2", Resipi Kot Petani Berlian ,"356,1,1,3932;356,2,1,2621;356,3,1,1747;356,4,1,1165;356,5,1,388;278,5,1,145",0,95309,1,90,-,1,0,4,0,15
0,Resipi Sarung Tangan Petani Berlian,2,recipe-icon-310,310,5,"401,2;405,2", Resipi Sarung Tangan Petani Berlian ,"357,1,1,3932;357,2,1,2621;357,3,1,1747;357,4,1,1165;357,5,1,388;473,5,1,145",0,95310,1,90,-,1,0,4,0,15
0, Resipi Seluar Petani Berlian,2,recipe-icon-311,311,5,"401,2;405,2", Resipi Seluar Petani Berlian ,"358,1,1,3932;358,2,1,2621;358,3,1,1747;358,4,1,1165;358,5,1,388;280,5,1,145",0,95311,1,90,-,1,0,4,0,15
0, Resipi Kasut Petani Berlian,2,recipe-icon-312,312,5,"401,2;405,2", Resipi Kasut Petani Berlian ,"359,1,1,3932;359,2,1,2621;359,3,1,1747;359,4,1,1165;359,5,1,388;281,5,1,145",0,95312,1,90,-,1,0,4,0,15
0, Resipi Pedang Bintang,2,recipe-icon-313,313,6,"405,2;409,1;412,1", Resipi Pedang Bintang ,"319,1,1,3990;319,2,1,2660;319,3,1,1773;319,4,1,1182;319,5,1,394",0,94313,1,270,-,2,0,4,0,20
0, Resipi Topi Pejuang Bintang,2,recipe-icon-314,314,6,"405,2;409,1;412,1", Resipi Topi Pejuang Bintang ,"345,1,1,3932;345,2,1,2621;345,3,1,1747;345,4,1,1165;345,5,1,388;282,5,1,145",0,94314,1,270,-,2,0,4,0,20
0, Resipi Kot Pejuang Bintang,2,recipe-icon-315,315,6,"405,2;409,1;412,1", Resipi Kot Pejuang Bintang ,"346,1,1,3932;346,2,1,2621;346,3,1,1747;346,4,1,1165;346,5,1,388;283,5,1,145",0,94315,1,270,-,2,0,4,0,20
0, Resipi Sarung Tangan Pejuang Bintang,2,recipe-icon-316,316,6,"405,2;409,1;412,1", Resipi Sarung Tangan Pejuang Bintang ,"347,1,1,3875;347,2,1,2583;347,3,1,1722;347,4,1,1148;347,5,1,382;279,5,1,143;284,5,1,143",0,94316,1,270,-,2,0,4,0,20
0, Resipi Seluar Pejuang Bintang,2,recipe-icon-317,317,6,"405,2;409,1;412,1", Resipi Seluar Pejuang Bintang,"348,1,1,3932;348,2,1,2621;348,3,1,1747;348,4,1,1165;348,5,1,388;285,5,1,145",0,94317,1,270,-,2,0,4,0,20
0, Resipi Kasut Pejuang Bintang,2,recipe-icon-318,318,6,"405,2;409,1;412,1", Resipi Kasut Star Fighter,"349,1,1,3932;349,2,1,2621;349,3,1,1747;349,4,1,1165;349,5,1,388;286,5,1,145",0,94318,1,270,-,2,0,4,0,20
0, Resipi Sabit Bintang,2,recipe-icon-319,319,6,"403,2;408,1;411,1", Resipi Sabit Star,"315,1,1,3990;315,2,1,2660;315,3,1,1773;315,4,1,1182;315,5,1,394",0,94319,1,270,-,3,0,4,0,20
0, Resipi Kapak Bintang,2,recipe-icon-320,320,6,"408,1;411,1;403,2", Resipi Kapak Star,"312,1,1,3990;312,2,1,2660;312,3,1,1773;312,4,1,1182;312,5,1,394",0,94320,1,270,-,3,0,4,0,20
0, Resipi Beliung Bintang,2,recipe-icon-321,321,6,"408,1;411,1;403,2", Resipi Beliung Star,"313,1,1,3990;313,2,1,2660;313,3,1,1773;313,4,1,1182;313,5,1,394",0,94321,1,270,-,3,0,4,0,20
0, Resipi Kot Kumpul Bintang,2,recipe-icon-323,323,6,"408,1;411,1;403,2", Resipi Baju Kumpul Star,"331,1,1,3932;331,2,1,2621;331,3,1,1747;331,4,1,1165;331,5,1,388;283,5,1,145",0,94323,1,270,-,3,0,4,0,20
0, Resipi Topi Kumpul Bintang,2,recipe-icon-322,322,6,"408,1;411,1;403,2", Resipi Topi Kumpul Star,"330,1,1,3932;330,2,1,2621;330,3,1,1747;330,4,1,1165;330,5,1,388;282,5,1,145",0,94322,1,270,-,3,0,4,0,20
0, Resipi Sarung Tangan Kumpul Bintang,2,recipe-icon-324,324,6,"408,1;411,1;403,2", Resipi Sarung Tangan Kumpul Star,"332,1,1,3875;332,2,1,2583;332,3,1,1722;332,4,1,1148;332,5,1,382;279,5,1,143;284,5,1,143",0,94324,1,270,-,3,0,4,0,20
0, Resipi Seluar Kumpul Bintang,2,recipe-icon-325,325,6,"408,1;411,1;403,2", Resipi Seluar Kumpul Star,"333,1,1,3932;333,2,1,2621;333,3,1,1747;333,4,1,1165;333,5,1,388;285,5,1,145",0,94325,1,270,-,3,0,4,0,20
0, Resipi Cangkul Bintang,2,recipe-icon-327,327,6,"402,2;406,2", Resipi Cangkul Star,"311,1,1,3990;311,2,1,2660;311,3,1,1773;311,4,1,1182;311,5,1,394",0,94327,1,270,-,1,0,4,0,20
0, Resipi Kasut Kumpul Bintang,2,recipe-icon-326,326,6,"408,1;411,1;403,2", Resipi Kasut Kumpul Star,"334,1,1,3932;334,2,1,2621;334,3,1,1747;334,4,1,1165;334,5,1,388;286,5,1,145",0,94326,1,270,-,3,0,4,0,20
0, Resipi Kot Petani Bintang,2,recipe-icon-330,330,6,"402,2;406,2", Resipi Baju Petani Star,"361,1,1,3932;361,2,1,2621;361,3,1,1747;361,4,1,1165;361,5,1,388;283,5,1,145",0,94330,1,270,-,1,0,4,0,20
0, Resipi Topi Petani Bintang,2,recipe-icon-329,329,6,"402,2;406,2", Resipi Topi Petani Star,"360,1,1,3932;360,2,1,2621;360,3,1,1747;360,4,1,1165;360,5,1,388;282,5,1,145",0,94329,1,270,-,1,0,4,0,20
0, Resipi Sarung Tangan Petani Bintang,2,recipe-icon-331,331,6,"402,2;406,2", Resipi Sarung Tangan Petani Star,"362,1,1,3875;362,2,1,2583;362,3,1,1722;362,4,1,1148;362,5,1,382;279,5,1,143;284,5,1,143",0,94331,1,270,-,1,0,4,0,20
0, Resipi Seluar Petani Bintang,2,recipe-icon-332,332,6,"402,2;406,2", Resipi Seluar Petani Star,"363,1,1,3932;363,2,1,2621;363,3,1,1747;363,4,1,1165;363,5,1,388;285,5,1,145",0,94332,1,270,-,1,0,4,0,20
0, Resipi Kasut Petani Bintang,2,recipe-icon-333,333,6,"402,2;406,2", Resipi Kasut Petani Star,"364,1,1,3932;364,2,1,2621;364,3,1,1747;364,4,1,1165;364,5,1,388;286,5,1,145",0,94333,1,270,-,1,0,4,0,20
0, Resipi Pati Penanaman Pertanian Tahap 4,2,recipe-icon-334,334,4,"383,5;384,5;385,5;212,2", Resipi Pati Tanam Pertanian Tahap 4,"407,1,1,10000",0,96334,1,30,-,1,0,4,0,0
0, Resipi Pati Penanaman Pertanian Tahap 5,2,recipe-icon-335,335,5,"386,5;387,5;388,5;407,2", Resipi Pati Tanam Pertanian Tahap 5,"408,1,1,10000",0,95335,1,90,-,1,0,4,0,0
0, Resipi Pati Penanaman Pertanian Tahap 6,2,recipe-icon-336,336,6,"389,5;390,5;391,5;408,2", Resipi Pati Tanam Pertanian Tahap 6,"409,1,1,10000",0,94336,1,270,-,1,0,4,0,0
0, Resipi Pati Ternakan Pertanian Tahap 4,2,recipe-icon-337,337,4,"392,5;393,5;394,5;215,2", Resipi Pati Ternakan Pertanian Tahap 4,"410,1,1,10000",0,96337,1,30,-,1,0,4,0,0
0, Resipi Pati Ternakan Pertanian Tahap 5,2,recipe-icon-338,338,5,"395,5;396,5;397,5;410,2", Resipi Pati Ternakan Pertanian Tahap 5,"411,1,1,10000",0,95338,1,90,-,1,0,4,0,0
0, Resipi Pati Ternakan Pertanian Tahap 6,2,recipe-icon-339,339,6,"398,5;399,5;400,5;411,2", Resipi Pati Ternakan Pertanian Tahap 6,"412,1,1,10000",0,94339,1,270,-,1,0,4,0,0
0, Resipi Intipati Pertempuran Tahap 4,2,recipe-icon-340,340,4,"365,5;366,5;367,5;218,2", Resipi Intipati Pertempuran Tahap 4,"401,1,1,10000",0,96340,1,30,-,2,0,4,0,0
0, Resipi Intipati Pertempuran Tahap 5,2,recipe-icon-341,341,5,"368,5;370,5;369,5;401,2", Resipi Intipati Pertempuran Tahap 5,"402,1,1,10000",0,95341,1,90,-,2,0,4,0,0
0, Resipi Intipati Pertempuran Tahap 6,2,recipe-icon-342,342,6,"371,5;372,5;373,5;402,2", Resipi Intipati Pertempuran Tahap 6,"403,1,1,10000",0,94342,1,270,-,2,0,4,0,0
0, Resipi Intipati Pengumpulan Tahap 4,2,recipe-icon-343,343,4,"375,5;376,5;374,5;209,2", Resipi Intipati Kumpul Tahap 4,"404,1,1,10000",0,96343,1,30,-,3,0,4,0,0
0, Resipi Intipati Pengumpulan Tahap 6,2,recipe-icon-345,345,6,"380,5;381,5;382,5;405,2", Resipi Intipati Kumpul Tahap 6,"406,1,1,10000",0,94345,1,270,-,3,0,4,0,0
0, Resipi Intipati Pengumpulan Tahap 5,2,recipe-icon-344,344,5,"377,5;378,5;379,5;404,2", Resipi Intipati Kumpul Tahap 5,"405,1,1,10000",0,95344,1,90,-,3,0,4,0,0
0, Resipi Ramuan Tahap 5,2,recipe-icon-347,347,5,"377,2;378,2;379,2", Resipi Ramuan Tahap 5,"429,1,1,5031;430,1,1,993;431,1,1,993;432,1,1,993;433,1,1,993;434,1,1,993",0,95347,1,90,-,3,0,4,0,0
0, Resipi Ramuan Tahap 4,2,recipe-icon-346,346,4,"374,2;375,2;376,2", Resipi Ramuan Tahap 4,"422,1,1,5031;423,1,1,993;424,1,1,993;425,1,1,993;426,1,1,993;427,1,1,993",0,96346,1,30,-,3,0,4,0,0
0, Resipi Ramuan Tahap 6,2,recipe-icon-348,348,6,"380,2;381,2;382,2", Resipi Ramuan Tahap 6,"435,1,1,5031;436,1,1,993;437,1,1,993;438,1,1,993;439,1,1,993;440,1,1,993",0,94348,1,270,-,3,0,4,0,0
0, Resipi Palu Tembaga Tahap 1,2,recipe-icon-364,364,1,"210,1;213,1",Resipi Palu Tembaga Tahap 1,"441,1,1,10000",0,99364,1,10,-,2,0,4,0,0
0, Resipi Palu Besi Tahap 2,2,recipe-icon-365,365,2,"207,2;211,1;214,1",Resipi Palu Besi Tahap 2,"442,1,1,6000;442,2,1,4000",0,98365,1,10,-,2,0,4,0,0
0, Resipi Palu Emas Tahap 4,2,recipe-icon-367,367,4,"209,2;407,1;410,1",Resipi Palu Emas Tahap 4,"444,1,1,4153;444,2,1,2769;444,3,1,1846;444,4,1,1230",0,96367,1,30,-,2,0,4,0,10
0,Resipi Palu Kristal Tahap 3,2,recipe-icon-366,366,3,"208,2;212,1;215,1",Resipi Palu Kristal Tahap 3,"443,1,1,4736;443,2,1,3157;443,3,1,2105",0,97366,1,10,-,2,0,4,0,0
0,Resipi Palu Berlian Tahap 5,2,recipe-icon-368,368,5,"404,2;408,1;411,1",Resipi Palu Berlian Tahap 5,"445,1,1,3990;445,2,1,2660;445,3,1,1773;445,4,1,1182;445,5,1,394",0,95368,1,90,-,2,0,4,0,15
0,Resipi Palu Cahaya Bintang Tahap 6,2,recipe-icon-369,369,6,"405,2;409,1;412,1",Resipi Palu Cahaya Bintang Tahap 6,"446,1,1,3990;446,2,1,2660;446,3,1,1773;446,4,1,1182;446,5,1,394",0,94369,1,270,-,2,0,4,0,20
0,Resipi Busur Batu Tahap 1,2,recipe-icon-370,370,1,"210,1;213,1",Resipi Busur Batu Tahap 1,"287,1,1,10000",0,99370,1,10,-,2,0,4,0,0
0,Resipi Busur Logam Tahap 2,2,recipe-icon-371,371,2,"207,2;211,1;214,1",Resipi Busur Logam Tahap 2,"288,1,1,6000;288,2,1,4000",0,98371,1,10,-,2,0,4,0,0
0,Resipi Busur Kristal Tahap 3,2,recipe-icon-372,372,3,"208,2;212,1;215,1",Resipi Busur Kristal Tahap 3,"289,1,1,4736;289,2,1,3157;289,3,1,2105",0,97372,1,10,-,2,0,4,0,0
0,Resipi Busur Emas Tahap 4,2,recipe-icon-373,373,4,"209,2;407,1;410,1",Resipi Busur Emas Tahap 4,"450,1,1,4153;450,2,1,2769;450,3,1,1846;450,4,1,1230",0,96373,1,30,-,2,0,4,0,10
0,Resipi Busur Berlian Tahap 5,2,recipe-icon-374,374,5,"404,2;408,1;411,1",Resipi Busur Berlian Tahap 5,"451,1,1,3990;451,2,1,2660;451,3,1,1773;451,4,1,1182;451,5,1,394",0,95374,1,90,-,2,0,4,0,15
0,Resipi Busur Cahaya Bintang Tahap 6,2,recipe-icon-375,375,6,"405,2;409,1;412,1",Resipi Busur Cahaya Bintang Tahap 6,"452,1,1,3990;452,2,1,2660;452,3,1,1773;452,4,1,1182;452,5,1,394",0,94375,1,270,-,2,0,4,0,20
0,Resipi Berus Tembaga Tahap 1,2,recipe-icon-376,376,1,"207,2",Resipi Berus Tembaga Tahap 1,"453,1,1,10000",0,99376,1,10,-,1,0,4,0,0
0,Resipi Berus Besi Tahap 2,2,recipe-icon-377,377,2,"216,2;208,2",Resipi Berus Besi Tahap 2,"454,1,1,6000;454,2,1,4000",0,98377,1,10,-,1,0,4,0,0
0,Resipi Berus Kristal Tahap 3,2,recipe-icon-378,378,3,"217,2;209,2",Resipi Berus Kristal Tahap 3,"455,1,1,4736;455,2,1,3157;455,3,1,2105",0,97378,1,10,-,1,0,4,0,0
0,Resipi Berus Emas Tahap 4,2,recipe-icon-379,379,4,"218,2;404,2",Resipi Berus Emas Tahap 4,"456,1,1,4153;456,2,1,2769;456,3,1,1846;456,4,1,1230",0,96379,1,30,-,1,0,4,0,10
0,Resipi Berus Berlian Tahap 5,2,recipe-icon-380,380,5,"401,2;405,2",Resipi Berus Berlian Tahap 5,"457,1,1,3990;457,2,1,2660;457,3,1,1773;457,4,1,1182;457,5,1,394",0,95380,1,90,-,1,0,4,0,15
0,Resipi Berus Cahaya Bintang Tahap 6,2,recipe-icon-381,381,6,"402,2;406,2",Resipi Berus Cahaya Bintang Tahap 6,"458,1,1,3990;458,2,1,2660;458,3,1,1773;458,4,1,1182;458,5,1,394",0,94381,1,270,-,1,0,4,0,20
0,Resipi Ramuan Pemulihan Tenaga - Kecil,2,recipe-icon-382,382,4,"383,4;384,4;385,4;479,1", Resipi Ramuan Pemulihan Tenaga - Kecil,"459,1,1,10000",0,96382,1,10,-,3,0,4,0,0
0,Resipi Ramuan Pemulihan Tenaga - Sederhana,2,recipe-icon-383,383,5,"387,4;386,4;388,4;479,1",Resipi Pemulihan Tenaga - Sederhana,"460,1,1,10000",0,95383,1,10,-,3,0,4,0,0
0,Resipi Ramuan Pemulihan Tenaga - Besar,2,recipe-icon-384,384,6,"389,4;390,4;391,4;479,1",Resipi Pemulihan Tenaga - Besar,"461,1,1,10000",0,94384,1,10,-,3,0,4,0,0
0,Resipi Tiket Loteri Alam Terapung - Tahap 4,0,recipe-icon-385,385,0,"365,8;366,8;367,8", Resipi Tiket Loteri Alam Terapung - Tahap 4,"464,1,3,10000",0,100385,1,10,-,0,0,4,0,1
0,Resipi Tiket Loteri Alam Terapung - Tahap 5,0,recipe-icon-386,386,0,"368,3;369,3;370,3", Resipi Tiket Loteri Alam Terapung - Tahap 5,"464,1,12,10000",0,100386,1,10,-,0,0,4,0,1
0, Resipi Tiket Loteri Floating Realm - Lv 6,0,recipe-icon-387,387,0,"371,1;372,1;373,1", Resipi Tiket Loteri Alam Terapung - Tahap 6,"464,1,18,10000",0,100387,1,10,-,0,0,4,0,1
0, Resipi Tiket Loteri Flower Peak - Lv 3,0,recipe-icon-389,389,0,"463,1", Resipi Tiket Loteri Puncak Bunga - Tahap 3,"465,1,12,10000",0,100389,1,10,-,0,0,4,0,1
0, Resipi Tiket Loteri Flower Peak - Lv 2,0,recipe-icon-388,388,0,"462,1", Resipi Tiket Loteri Puncak Bunga - Tahap 2,"465,1,3,10000",0,100388,1,10,-,0,0,4,0,1
0, Resipi Tiket Loteri Dunia Terbuka - Lv 1 (Bahan Liar),0,recipe-icon-390,390,0,"207,2;216,2;210,1;213,1", Tiket Loteri Dunia Tahap 1 (Bahan Liar),"466,1,3,10000",0,100390,1,10,-,0,0,4,0,0
0, Resipi Tiket Loteri Dunia Terbuka - Lv 1 (Bahan Liar),0,recipe-icon-391,391,0,"208,2;217,2;211,1;214,1", Tiket Loteri Dunia Tahap 2 (Bahan Liar),"466,1,12,10000",0,100391,1,10,-,0,0,4,0,0
0, Resipi Tiket Loteri Dunia Terbuka - Lv 1 (Bahan Liar),0,recipe-icon-392,392,0,"209,2;218,2;212,1;212,1", Tiket Loteri Dunia Tahap 3 (Bahan Liar),"466,1,27,10000",0,100392,1,10,-,0,0,4,0,0
0, Resipi Tiket Loteri Dunia Terbuka - Lv 1 (Bahan Ladang),0,recipe-icon-393,393,0,"70,10;71,10;72,10;177,10", Resipi Tiket Loteri Dunia Terbuka Tahap 1 (Bahan Ladang),"466,1,3,10000",0,100393,1,10,-,0,0,4,0,0
0, Resipi Tiket Loteri Dunia Terbuka - Lv 2 (Bahan Ladang),0,recipe-icon-394,394,0,"73,10;74,10;75,10;180,10;181,10;182,10", Resipi Tiket Loteri Dunia Terbuka Tahap 2 (Bahan Ladang),"466,1,12,10000",0,100394,1,10,-,0,0,4,0,0
0, Resipi Tiket Loteri Dunia Terbuka - Lv 3 (Bahan Ladang),0,recipe-icon-395,395,0,"76,10;77,10;78,10;183,10;184,10;185,10", Resipi Tiket Loteri Dunia Terbuka Tahap 3 (Bahan Ladang),"466,1,27,10000",0,100395,1,10,-,0,0,4,0,0
0, Resipi Tiket Penerimaan Floating Realm,0,recipe-icon-396,396,0,"209,2;218,2;212,1;215,1", Resipi Tiket Masuk Alam Terapung,"467,1,1,10000",0,100396,1,5,-,0,1,1,0,3
0, Penukaran Tiket Penerimaan Floating Realm,0,recipe-icon-397,397,0,"469,2", Penukaran Tiket Masuk Dungeon,"468,1,1,8500;467,1,1,1500",0,100397,1,5,-,0,1,1,0,0
0, Resipi Tiket Masuk Puncak Bunga,0,recipe-icon-398,398,0,"207,2;216,2;210,1;213,1", Resipi Tiket Masuk Puncak Bunga,"468,1,1,10000",0,100398,1,5,-,0,1,1,0,1
0, Menghasilkan Lv 0 Sabit Kayu,2,recipe-icon-404,404,0,"62,10;58,10", Resipi Cangkul Tembaga Tahap 1,"225,1,1,10000",0,100404,1,10,-,3,1,1,0,0
0, Resipi Biji Gandum,2,recipe-icon-405,405,4,"383,1", Resipi Biji Gandum Tahap 4,"413,1,1,8350;416,1,1,1649",0,96405,1,10,-,1,0,4,0,0
0, Resipi Biji Kacang Peas,2,recipe-icon-406,406,4,"384,1", Resipi Biji Kacang Peas Tahap 4,"414,1,1,8350;417,1,1,1649",0,96406,1,10,-,1,0,4,0,0
0, Resipi Biji Bawang Putih,2,recipe-icon-407,407,4,"385,1", Resipi Biji Bawang Putih Tahap 4,"415,1,1,8350;418,1,1,1649",0,96407,1,10,-,1,0,4,0,0
0, Resipi Biji Bunga Matahari,2,recipe-icon-410,410,5,"386,1", Resipi Biji Bunga Matahari Tahap 5,"416,1,1,8350;419,1,1,1649",0,95410,1,10,-,1,0,4,0,0
0, Resipi Biji Anggur,2,recipe-icon-411,411,5,"387,1", Resipi Biji Anggur Tahap 5,"417,1,1,8350;420,1,1,1649",0,95411,1,10,-,1,0,4,0,0
0, Resipi Biji Kentang,2,recipe-icon-412,412,5,"388,1",Resipi Biji Kentang Tahap 5,"418,1,1,8350;421,1,1,1649",0,95412,1,10,-,1,0,4,0,0
0, Resipi Biji Chomper,2,recipe-icon-413,413,6,"389,1",Resipi Biji Chomper Tahap 6,"419,1,1,10000",0,94413,1,10,-,1,0,4,0,0
0, Resipi Biji Bunga Morning Glory,2,recipe-icon-414,414,6,"390,1",Resipi Biji Bunga Morning glory Tahap 6,"420,1,1,10000",0,94414,1,10,-,1,0,4,0,0
0, Resipi Biji Cassava,2,recipe-icon-415,415,6,"391,1",Resipi Biji Cassava Tahap 6,"421,1,1,10000",0,94415,1,10,-,1,0,4,0,0
0, Resipi Cerek Emas Lv 4,2,recipe-icon-416,416,4,"218,2;404,2",Resipi Cerek Emas Tahap 4,"304,1,1,4153;304,2,1,2769;304,3,1,1846;304,4,1,1230",0,96416,1,30,-,1,0,4,0,10
0, Resipi Cerek Berlian Lv 5,2,recipe-icon-417,417,5,"401,2;405,2",Resipi Cerek Berlian Tahap 5,"310,1,1,3990;310,2,1,2660;310,3,1,1773;310,4,1,1182;310,5,1,394",0,95417,1,90,-,1,0,4,0,15
0, Resipi Cerek Bintang Lv 6,2,recipe-icon-418,418,6,"402,2;406,2",Resipi Cerek Bintang Tahap 6,"316,1,1,3990;316,2,1,2660;316,3,1,1773;316,4,1,1182;316,5,1,394",0,94418,1,270,-,1,0,4,0,20
0,10000 LUAG 5%6000 LUAG 15%4000 LUAG 30%2500 LUAG 50%,2,recipe-icon-419,419,4,"401,1;463,3;481,1", Resipi Pertukaran LUAG Tahap 4 - Pertempuran,"478,1,100,500;478,1,60,1500;478,1,40,3000;478,1,25,5000",0,96419,1,3,80,0,1,1,0,118
0,Anda mungkin akan menerima ganjaran berikut:10000 LUAG 5%6000 LUAG 15%4000 LUAG 30%2500 LUAG 50%,2,recipe-icon-420,420,4,"404,1;365,2;481,1;392,2", Resipi Pertukaran LUAG Tahap 4 - Mengumpul,"478,1,100,500;478,1,60,1500;478,1,40,3000;478,1,25,5000",0,96420,1,3,80,0,1,1,0,118
0,Anda mungkin akan menerima ganjaran berikut:10000 LUAG 5%6000 LUAG 15%4000 LUAG 30%2500 LUAG 50%,2,recipe-icon-421,421,4,"407,1;366,2;481,1;393,2", Resipi Pertukaran LUAG Tahap 4 - Penanaman,"478,1,100,500;478,1,60,1500;478,1,40,3000;478,1,25,5000",0,96421,1,3,40,0,1,1,0,118
0,Anda mungkin akan menerima ganjaran berikut:10000 LUAG 5%6000 LUAG 15%4000 LUAG 30%2500 LUAG 50%,2,recipe-icon-422,422,4,"410,1;367,2;481,1;394,2", Resipi Pertukaran LUAG Tahap 4 - Ternakan,"478,1,100,500;478,1,60,1500;478,1,40,3000;478,1,25,5000",0,96422,1,3,40,0,1,1,0,118
0,Anda mungkin akan menerima ganjaran berikut:40000 LUAG 1%9000 LUAG 4%6000 LUAG 10%5500 LUAG 35%3000 LUAG 50%,2,recipe-icon-423,423,1,"216,1;478,50", Resipi Loteri LUAG Tahap 1,"478,1,400,100;478,1,90,400;478,1,60,1500;478,1,55,3000;478,1,30,5000",0,99423,1,3,-,0,1,1,0,3
0,Anda mungkin akan menerima ganjaran berikut:40000 LUAG 1%9000 LUAG 4%6000 LUAG 10%5500 LUAG 35%3000 LUAG 50%,2,recipe-icon-424,424,1,"207,1;478,50", Resipi Loteri LUAG Tahap 1,"478,1,400,100;478,1,90,400;478,1,60,1500;478,1,55,3000;478,1,30,5000",0,99424,1,3,-,0,1,1,0,3
0,Anda mungkin akan menerima ganjaran berikut:40000 LUAG 1%9000 LUAG 4%6000 LUAG 10%5500 LUAG 35%3000 LUAG 50%,2,recipe-icon-425,425,1,"210,1;478,50", Resipi Loteri LUAG Tahap 1,"478,1,400,100;478,1,90,400;478,1,60,1500;478,1,55,3000;478,1,30,5000",0,99425,1,3,-,0,1,1,0,3
0,Anda mungkin akan menerima ganjaran berikut:40000 LUAG 1%9000 LUAG 4%6000 LUAG 10%5500 LUAG 35%3000 LUAG 50%,2,recipe-icon-426,426,1,"213,1;478,50", Resipi Loteri LUAG Tahap 1,"478,1,400,100;478,1,90,400;478,1,60,1500;478,1,55,3000;478,1,30,5000",0,99426,1,3,-,0,1,1,0,3
0,Anda mungkin akan menerima ganjaran berikut:80000 LUAG 1%18000 LUAG 4%12000 LUAG 10%11000 LUAG 35%6000 LUAG 50%,2,recipe-icon-427,427,2,"217,1;478,100", Resipi Loteri LUAG Tahap 2,"478,1,800,100;478,1,180,400;478,1,120,1500;478,1,110,3000;478,1,60,5000",0,98427,1,3,-,0,1,1,0,3
0,Anda mungkin akan menerima ganjaran berikut:80000 LUAG 1%18000 LUAG 4%12000 LUAG 10%11000 LUAG 35%6000 LUAG 50%,2,recipe-icon-428,428,2,"208,1;478,100", Resipi Loteri LUAG Tahap 2,"478,1,800,100;478,1,180,400;478,1,120,1500;478,1,110,3000;478,1,60,5000",0,98428,1,3,-,0,1,1,0,3
0,Anda mungkin akan menerima ganjaran berikut:80000 LUAG 1%18000 LUAG 4%12000 LUAG 10%11000 LUAG 35%6000 LUAG 50%,2,recipe-icon-430,430,2,"214,1;478,100", Resipi Loteri LUAG Tahap 2,"478,1,800,100;478,1,180,400;478,1,120,1500;478,1,110,3000;478,1,60,5000",0,98430,1,3,-,0,1,1,0,3
0,Anda mungkin akan menerima ganjaran berikut:80000 LUAG 1%18000 LUAG 4%12000 LUAG 10%11000 LUAG 35%6000 LUAG 50%,2,recipe-icon-429,429,2,"211,1;478,100", Resipi Loteri LUAG Tahap 2,"478,1,800,100;478,1,180,400;478,1,120,1500;478,1,110,3000;478,1,60,5000",0,98429,1,3,-,0,1,1,0,3
0,Anda mungkin akan menerima ganjaran berikut:160000 LUAG 1%36000 LUAG 4%24000 LUAG 10%22000 LUAG 35%12000 LUAG 50%,2,recipe-icon-431,431,3,"218,1;478,200", Resipi Loteri LUAG Tahap 3,"478,1,1600,100;478,1,360,400;478,1,240,1500;478,1,220,3000;478,1,120,5000",0,97431,1,3,-,0,1,1,0,3
0,Anda mungkin akan menerima ganjaran berikut:160000 LUAG 1%36000 LUAG 4%24000 LUAG 10%22000 LUAG 35%12000 LUAG 50%,2,recipe-icon-432,432,3,"209,1;478,200", Resipi Loteri LUAG Tahap 3,"478,1,1600,100;478,1,360,400;478,1,240,1500;478,1,220,3000;478,1,120,5000",0,97432,1,3,-,0,1,1,0,3
0,Anda mungkin akan menerima ganjaran berikut:160000 LUAG 1%36000 LUAG 4%24000 LUAG 10%22000 LUAG 35%12000 LUAG 50%,2,recipe-icon-433,433,3,"212,1;478,200", Resipi Loteri LUAG Tahap 3,"478,1,1600,100;478,1,360,400;478,1,240,1500;478,1,220,3000;478,1,120,5000",0,97433,1,3,-,0,1,1,0,3
0,Anda mungkin akan menerima ganjaran berikut:160000 LUAG 1%36000 LUAG 4%24000 LUAG 10%22000 LUAG 35%12000 LUAG 50%,2,recipe-icon-434,434,3,"215,1;478,200", Resipi Loteri LUAG Tahap 3,"478,1,1600,100;478,1,360,400;478,1,240,1500;478,1,220,3000;478,1,120,5000",0,97434,1,3,-,0,1,1,0,3
0,Tukar semula Jaket Mengumpul Anda,2,recipe-icon-435,435,1,"216,2;119,1", Tahap 1 Penyelenggaraan Semula Jaket Pengumpulan ,"119,1,1,10000",0,99435,1,10,-,3,0,4,0,0
0,Tukar semula Kapak Besi Anda,2,recipe-icon-436,436,1,"216,2;92,1", Tahap 1 Penyelenggaraan Semula Kapak Besi ,"92,1,1,10000",0,99436,1,10,-,1,0,4,0,0
0,Tukar semula Topi Pertanian Emas Anda,2,recipe-icon-526,526,4,"350,1;209,2", Tahap 4 Penyucian semula Topi Petani Emas,"350,1,1,4153;350,2,1,2769;350,3,1,1846;350,4,1,1230",0,96526,1,10,-,1,0,4,0,10
0,Tukar semula Sabit Besi Anda,2,recipe-icon-480,480,2,"227,1;216,2",Pemprosesan semula Sabit Besi Lv 2,"227,1,1,6000;227,2,1,4000",0,98480,1,10,-,3,0,4,0,0
0,Tukar semula Kapak Berlian Anda,2,recipe-icon-537,537,5,"306,1;401,2", Pemprosesan Semula Kapak Berlian Tahap 5,"306,1,1,3990;306,2,1,2660;306,3,1,1773;306,4,1,1182;306,5,1,394",0,95537,1,10,-,3,0,4,0,15
0,Tukar semula Jaket Pertanian Anda,2,recipe-icon-462,462,2,"102,1;207,2", Tahap 2 Penyelenggaraan Semula Jaket Pertanian,"102,1,1,6000;102,2,1,4000",0,98462,1,10,-,1,0,4,0,0
0,Ubahsuai semula Sarung Tangan Petani Berlian Anda,2,recipe-icon-548,548,5,"357,1;404,2", Tahap 5 Penukaran Semula Sarung Tangan Petani Berlian,"357,1,1,3990;357,2,1,2660;357,3,1,1773;357,4,1,1182;357,5,1,394",0,95548,1,10,-,1,0,4,0,15
0,Tukar semula Busur Batu Anda,2,recipe-icon-444,444,1,"287,1;213,1;210,1", Tahap 1 Penyelenggaraan Semula Busur Batu ,"287,1,1,10000",0,99444,1,10,-,2,0,4,0,0
0,Ubahsuai semula Kasut Petani Bintang Anda,2,recipe-icon-568,568,6,"364,1;405,2", Pemprosesan Semula Kasut Tani Bintang Tahap 6,"364,1,1,3990;364,2,1,2660;364,3,1,1773;364,4,1,1182;364,5,1,394",0,94568,1,10,-,1,0,4,0,20
0,Tukar semula Sarung Tangan Mengumpul Anda,2,recipe-icon-487,487,3,"208,2;127,1",Pemprosesan semula Sarung Tangan Mengumpul Lv 3,"127,1,1,4736;127,2,1,3157;127,3,1,2105",0,97487,1,10,-,3,0,4,0,0
0,Tukar semula Kapak Terkutuk Anda,2,recipe-icon-468,468,2,"93,1;216,2",Pemprosesan semula Kapak Terkutuklah Lv 2,"93,1,1,6000;93,2,1,4000",0,98468,1,10,-,3,0,4,0,0
0,Tukar semula Pedang Besi Anda,2,recipe-icon-479,479,2,"41,1;213,1;210,1",Pemprosesan semula Pedang Besi Lv 2,"41,1,1,6000;41,2,1,4000",0,98479,1,10,-,2,0,4,0,0
0,Ubahsuai semula Seluar Pejuang Berlian Anda,2,recipe-icon-540,540,5,"343,1;410,1;407,1", Pemprosesan Semula Seluar Pahlawan Berlian Tahap 5,"343,1,1,3990;343,2,1,2660;343,3,1,1773;343,4,1,1182;343,5,1,394",0,95540,1,10,-,2,0,4,0,15
0,Ubahsuai semula Topi Petani Bintang Anda,2,recipe-icon-573,573,6,"360,1;405,2", Pemprosesan Semula Topi Tani Bintang Tahap 6,"360,1,1,3990;360,2,1,2660;360,3,1,1773;360,4,1,1182;360,5,1,394",0,94573,1,10,-,1,0,4,0,20
0,Tukar semula Sarung Tangan Mengumpul Anda,2,recipe-icon-452,452,1,"125,1;216,2", Tahap 1 Penyelenggaraan Semula Sarung Tangan Pengumpulan ,"125,1,1,10000",0,99452,1,10,-,3,0,4,0,0
0,Tukar semula Cerek Diberkati Anda,2,recipe-icon-506,506,3,"86,1;208,2",Pemprosesan semula Cerek yang Diberkati Lv 3,"86,1,1,4736;86,2,1,3157;86,3,1,2105",0,97506,1,10,-,1,0,4,0,0
0,Tukar semula Cangkul Diberkati Anda,2,recipe-icon-505,505,3,"82,1;208,2", Tahap 3 Penyucian semula Cangkul yang Diberkati,"82,1,1,4736;82,2,1,3157;82,3,1,2105",0,97505,1,10,-,1,0,4,0,0
0,Tukar semula Sarung Tangan Pertanian Anda,2,recipe-icon-460,460,2,"108,1;207,2",Pemprosesan semula Sarung Tangan Pertanian Lv 2,"108,1,1,6000;108,2,1,4000",0,98460,1,10,-,1,0,4,0,0
0,Tukar semula Kasut Rumput Kristal Retak Anda,2,recipe-icon-449,449,1,"55,1;213,1;210,1", Tahap 1 Penyelenggaraan Semula Kasut Pahlawan Skirt Pecah Kristal ,"55,1,1,10000",0,99449,1,10,-,2,0,4,0,0
0,Tukar semula Jaket Pertanian Anda,2,recipe-icon-501,501,3,"103,1;208,2", Tahap 3 Penyucian semula Jaket Pertanian,"103,1,1,4736;103,2,1,3157;103,3,1,2105",0,97501,1,10,-,1,0,4,0,0
0,Ubahsuai semula Kot Pengumpul Berlian Anda,2,recipe-icon-539,539,5,"326,1;401,2", Pemprosesan Semula Baju Kumpul Berlian Tahap 5,"326,1,1,3990;326,2,1,2660;326,3,1,1773;326,4,1,1182;326,5,1,394",0,95539,1,10,-,3,0,4,0,15
