classifyLevel-int,desc-string,displayType-int,icon-string,id-int,level-int,matItemId-int[][],name-string,productId-int[][],proficiency-int,recipesSort-int,sourceText-int,timeCost-int,type-int,unlockCondition-int,unlockType-int,useDitamin-int,useMELD-int
1, Membuat Pedang Batu Tahap 1 ,2,recipe-icon-44,44,1,"210,1;213,1",Tahap 1 Resipi Pedang Batu ,"40,1,1,10000",0,1,1,10,2,0,4,0,0
0, Membuat Pedang Besi Tahap 2 ,2,recipe-icon-45,45,2,"207,2;211,1;214,1", Tahap 2 Resipi Pedang Besi ,"41,1,1,6000;41,2,1,4000",0,1,1,10,2,0,4,0,0
0, Membuat Pedang Kristal Tahap 3 ,2,recipe-icon-46,46,3,"208,2;212,1;215,1", Tahap 3 Resipi Pedang Kristal ,"42,1,1,4736;42,2,1,3157;42,3,1,2105",0,1,1,10,2,0,4,0,5
0, Membuat Cangkul Besi Tahap 1 ,2,recipe-icon-62,62,1,"207,2", Tahap 1 Resipi Cangkul Besi ,"80,1,1,10000",0,1,1,10,1,0,4,0,0
0, Membuat Baja yang Melembapkan Tahap 0 ,2,recipe-icon-94,94,1,"69,1", Tahap 0 Resipi Baja yang Melembapkan ,"130,1,1,10000",0,3,1,10,1,0,4,0,0
0, Membuat Cangkul yang Diberkati Tahap 3 ,2,recipe-icon-64,64,3,"217,2;209,2", Tahap 3 Resipi Cangkul yang Diberkati ,"82,1,1,10000",0,1,1,10,1,0,4,0,5
0, Membuat Baja yang Meningkatkan Hasil Tahap 0 ,2,recipe-icon-93,93,1,"61,1", Tahap 0 Resipi Baja yang Meningkatkan Hasil ,"129,1,1,10000",0,3,1,10,1,0,4,0,0
0, Membuat Cerek Terkutuk Tahap 2 ,2,recipe-icon-67,67,2,"216,2;208,2", Tahap 2 Resipi Cerek Terkutuk ,"85,2,1,4000;84,1,1,6000",0,1,1,10,1,0,4,0,0
0, Membuat Kapak yang Diberkati Tahap 3 ,2,recipe-icon-76,76,3,"211,1;214,1;218,2", Tahap 3 Resipi Kapak yang Diberkati ,"94,1,1,10000",0,1,1,10,3,0,4,0,5
0, Membuat Ramuan Penyembuhan Kecil Tahap 0 ,2,recipe-icon-95,95,1,"66,5;32,5", Tahap 0 Resipi Ramuan Penyembuhan Kecil ,"134,1,1,1666;135,1,1,1666;136,1,1,1666;137,1,1,1666;139,1,1,1666;138,1,1,1666",0,3,1,10,3,0,4,0,0
0, Membuat Ramuan Penyembuhan Tahap 1 ,2,recipe-icon-96,96,2,"67,2;75,2;35,2", Tahap 1 Resipi Ramuan Penyembuhan ,"140,1,1,1666;142,1,1,1666;141,1,1,1666;143,1,1,1666;145,1,1,1666;144,1,1,1666",0,3,1,10,3,0,4,0,0
0, Membuat Cangkul Terkutuk Tahap 2 ,2,recipe-icon-63,63,2,"216,2;208,2", Tahap 2 Resipi Cangkul Terkutuk ,"81,1,1,10000",0,1,1,10,1,0,4,0,0
0, Membuat Beliung Terkutuk Tahap 2 ,2,recipe-icon-71,71,2,"210,1;213,1;217,2", Tahap 2 Resipi Beliung Terkutuk ,"89,1,1,6000;89,2,1,4000",0,1,1,10,3,0,4,0,0
0, Membuat Beliung Besi Tahap 1 ,2,recipe-icon-70,70,1,"216,2", Tahap 1 Resipi Beliung Besi ,"88,1,1,10000",0,1,1,10,3,0,4,0,0
0, Membuat Beliung yang Diberkati Tahap 3 ,2,recipe-icon-72,72,3,"211,1;214,1;218,2", Tahap 3 Resipi Beliung yang Diberkati ,"90,1,1,10000",0,1,1,10,3,0,4,0,5
0, Membuat Cerek yang Diberkati Tahap 3 ,2,recipe-icon-68,68,3,"217,2;209,2", Tahap 3 Resipi Cerek yang Diberkati ,"86,1,1,10000",0,1,1,10,1,0,4,0,5
0, Membuat Kapak Besi Tahap 1 ,2,recipe-icon-74,74,1,"216,2", Tahap 1 Resipi Kapak Besi ,"92,1,1,10000",0,1,1,10,3,0,4,0,0
0, Membuat Cerek Besi Tahap 1 ,2,recipe-icon-66,66,1,"207,2", Tahap 1 Resipi Cerek Besi ,"84,1,1,10000",0,1,1,10,1,0,4,0,0
0, Membuat Baja Dipercepat Tahap 0 ,2,recipe-icon-92,92,1,"65,1", Tahap 0 Resipi Baja Dipercepatkan ,"128,1,1,10000",0,3,1,10,1,0,4,0,0
0, Membuat Kapak Terkutuk Tahap 2 ,2,recipe-icon-75,75,2,"210,1;213,1;217,2", Tahap 2 Resipi Kapak Terkutuk ,"93,1,1,6000;93,2,1,4000",0,1,1,10,3,0,4,0,0
0, Membuat Baja Melembapkan yang Lebih Maju Tahap 0 ,2,recipe-icon-101,101,2,"69,2;35,2", Tahap 0 Resipi Baja Melembapkan yang Lanjutan ,"133,1,1,10000",0,3,1,10,1,0,4,0,0
0, Membuat Baja yang Meningkatkan Hasil yang Lebih Maju Tahap 0 ,2,recipe-icon-102,102,2,"61,2;35,2", Tahap 0 Resipi Baja yang Meningkatkan Hasil yang Lanjutan ,"132,1,1,10000",0,3,1,10,1,0,4,0,0
0, Membuat Baja Dipercepat yang Lebih Maju Tahap 0 ,2,recipe-icon-103,103,2,"65,2;35,2", Tahap 0 Resipi Baja Dipercepatkan yang Lanjutan ,"131,1,1,10000",0,3,1,10,1,0,4,0,0
0, Membuat Azimat Tahap 0 ,2,recipe-icon-104,104,1,"32,20;71,40;58,40;62,40;66,40", Tahap 0 Resipi Azimat ,"161,1,1,4736;161,2,1,3157;161,3,1,2105",0,2,1,10,0,0,4,0,100
0, Membuat Azimat Tahap 0 ,2,recipe-icon-106,106,1,"38,20;77,40;60,40;64,40;68,40", Tahap 0 Resipi Azimat ,"161,2,1,4426;161,3,1,2950;161,4,1,1967;161,5,1,655",0,2,1,10,0,0,4,0,200
0, Membuat Topi Semanggi Bertuah Tahap 1 ,2,recipe-icon-108,108,1,"207,2", Tahap 1 Resipi Topi Semanggi Bertuah ,"98,1,1,9101;267,5,1,898",0,2,1,10,1,0,4,0,0
0, Membuat Topi Kapas Bertuah Tahap 2 ,2,recipe-icon-109,109,2,"216,2;208,2", Tahap 1 Resipi Topi Kapas Bertuah ,"99,1,1,5664;99,2,1,3776;262,5,1,559",0,2,1,10,1,0,4,0,0
0, Membuat Topi Keras Bertuah Tahap 3 ,2,recipe-icon-110,110,3,"217,2;209,2", Tahap 3 Resipi Topi Keras Bertuah ,"100,1,1,4525;100,2,1,3016;100,3,1,2011;272,5,1,446",0,2,1,10,1,0,4,0,5
0, Membuat Topi Koleksi Tahap 1 ,2,recipe-icon-111,111,1,"216,2", Tahap 1 Resipi Topi Koleksi ,"116,1,1,9101;267,5,1,898",0,2,1,10,3,0,4,0,0
0, Membuat Topi Koleksi Tahap 2 ,2,recipe-icon-112,112,2,"210,1;213,1;217,2", Tahap 2 Resipi Topi Koleksi ,"117,1,1,5664;117,2,1,3776;262,5,1,559",0,2,1,10,3,0,4,0,0
0, Membuat Topi Koleksi Tahap 3 ,2,recipe-icon-113,113,3,"211,1;214,1;218,2", Tahap 3 Resipi Topi Koleksi ,"118,1,1,4525;118,3,1,2011;118,2,1,3016;272,5,1,446",0,2,1,10,3,0,4,0,5
0, Membuat Biji Buluh Tahap 1 ,2,recipe-icon-123,123,1,"70,1;62,10", Tahap 1 Resipi Biji Buluh ,"146,1,2,5000;150,1,1,5000",0,3,1,10,1,0,4,0,0
0, Membuat Biji Semanggi Tahap 1 ,2,recipe-icon-124,124,1,"71,1;62,10", Tahap 1 Resipi Biji Semanggi ,"147,1,2,5000;149,1,1,5000",0,3,1,10,1,0,4,0,0
0, Membuat Biji Lobak Merah Tahap 1 ,2,recipe-icon-125,125,1,"62,10", Tahap 1 Resipi Biji Lobak Merah ,"148,1,2,5000;151,1,1,5000",0,3,1,10,1,0,4,0,0
0, Membuat Biji Nepenthes Tahap 2 ,2,recipe-icon-126,126,2,"73,1", Tahap 2 Resipi Biji Nepenthes ,"149,1,2,5000;154,1,1,5000",0,3,1,10,1,0,4,0,0
0, Membuat Biji Kapas Tahap 2 ,2,recipe-icon-127,127,2,"74,1", Tahap 2 Resipi Biji Kapas ,"150,1,2,5000;152,1,1,5000",0,3,1,10,1,0,4,0,0
0, Membuat Biji Kaktus Tahap 2 ,2,recipe-icon-128,128,2,"75,1", Tahap 2 Resipi Biji Kaktus ,"151,1,2,5000;153,1,1,5000",0,3,1,10,1,0,4,0,0
0, Membuat Biji Lada Panas Tahap 3 ,2,recipe-icon-129,129,3,"76,1", Tahap 3 Resipi Cili Api ,"152,1,2,10000",0,3,1,10,1,0,4,0,0
0, Membuat Biji Buah Keras Tahap 3 ,2,recipe-icon-130,130,3,"77,1", Tahap 3 Resipi Buah Keras ,"153,1,2,10000",0,3,1,10,1,0,4,0,0
0, Membuat Biji Cendawan Hantu Biru Tahap 3 ,2,recipe-icon-131,131,3,"78,1", Tahap 3 Resipi Biji Cendawan Hantu Biru ,"154,1,2,10000",0,3,1,10,1,0,4,0,0
0, Membuat Ramuan Penyembuhan Kristal Tahap 2 ,2,recipe-icon-132,132,3,"68,2;78,2;38,2", Tahap 2 Resipi Ramuan Penyembuhan Kristal ,"191,1,1,1666;192,1,1,1666;194,1,1,1666;195,1,1,1666;196,1,1,1666;197,1,1,1666",0,3,1,10,3,0,4,0,0
0, Membuat Cincin Serpihan Kristal Tahap 1 ,2,recipe-icon-133,133,1,"210,1;213,1", Tahap 1 Resipi Bulatan Serpihan Kristal ,"43,1,1,9101;267,5,1,898",0,1,1,10,2,0,4,0,0
0, Membuat Topi Kulit Kristal Tahap 2 ,2,recipe-icon-134,134,2,"207,2;211,1;214,1", Tahap 2 Resipi Topi Kulit Kristal ,"44,1,1,5664;44,2,1,3776;262,5,1,559",0,1,1,10,2,0,4,0,0
0, Membuat Helmet Kristal Tahap 3 ,2,recipe-icon-135,135,3,"208,2;212,1;215,1", Tahap 3 Resipi Helmet Pahlawan Hedron ,"45,1,1,4525;45,2,1,3016;45,3,1,2011;272,5,1,446",0,1,1,10,2,0,4,0,5
0, Membuat Atasan Kulit Kristal Tahap 2 ,2,recipe-icon-137,137,2,"207,2;211,1;214,1", Tahap 2 Resipi Atasan Warrior Baju Atasan Kulit Kristal ,"47,1,1,5664;47,2,1,3776;263,5,1,559",0,1,1,10,2,0,4,0,0
0, Membuat Tunik Serpihan Kristal Tahap 1 ,2,recipe-icon-136,136,1,"210,1;213,1", Tahap 1 Resipi Perisai Anggur Serpihan Kristal ,"46,1,1,9101;268,5,1,898",0,1,1,10,2,0,4,0,0
0, Membuat Armor Kristal Tahap 3 ,2,recipe-icon-138,138,3,"208,2;212,1;215,1", Tahap 3 Resipi Perisai Hedron Tunik Pahlawan ,"48,1,1,4525;48,2,1,3016;48,3,1,2011;273,5,1,446",0,1,1,10,2,0,4,0,5
0, Membuat Skirt Hula Serpihan Kristal Tahap 1 ,2,recipe-icon-139,139,1,"210,1;213,1", Tahap 1 Resipi Seluar Pahlawan Skirt Hula Pecah Kristal ,"49,1,1,9101;270,5,1,898",0,1,1,10,2,0,4,0,0
0, Membuat Seluar Kulit Kristal Tahap 2 ,2,recipe-icon-140,140,2,"207,2;211,1;214,1", Tahap 2 Resipi Seluar Pahlawan Seluar Kulit Kristal ,"50,1,1,5664;50,2,1,3776;265,5,1,559",0,1,1,10,2,0,4,0,0
0, Membuat Leg Armor Kristal Tahap 3 ,2,recipe-icon-141,141,3,"208,2;212,1;215,1", Tahap 3 Resipi Warrior Seluar Hedron Legguards ,"51,1,1,4525;51,2,1,3016;51,3,1,2011;274,5,1,446",0,1,1,10,2,0,4,0,5
0, Membuat Kasut Serpihan Kristal Tahap 1 ,2,recipe-icon-142,142,1,"210,1;213,1", Tahap 1 Resipi Sarung Tangan Pahlawan Gelang Serpihan Kristal ,"55,1,1,9101;271,5,1,898",0,1,1,10,2,0,4,0,0
0, Membuat Kasut Kulit Kristal Tahap 2 ,2,recipe-icon-143,143,2,"207,2;211,1;214,1", Tahap 2 Resipi Sarung Tangan Warrior Sarung Tangan Kulit Kristal ,"56,1,1,5664;56,2,1,3776;266,5,1,559",0,1,1,10,2,0,4,0,0
0, Membuat Kasut Kristal Tahap 3 ,2,recipe-icon-144,144,3,"208,2;212,1;215,1", Tahap 3 Resipi Sarung Tangan Pahlawan Hedron Gauntlets ,"57,1,1,4525;57,2,1,3016;57,3,1,2011;275,5,1,446",0,1,1,10,2,0,4,0,5
0, Membuat Sarung Tangan Serpihan Kristal Tahap 1 ,2,recipe-icon-145,145,1,"210,1;213,1", Tahap 1 Resipi Sandal Serpihan Kasut Pahlawan ,"52,1,1,9101;269,5,1,898",0,1,1,10,2,0,4,0,0
0, Membuat Sarung Tangan Kulit Kristal Tahap 2 ,2,recipe-icon-146,146,2,"207,2;211,1;214,1", Tahap 2 Resipi Kasut Warrior But Kulit Kristal ,"53,1,1,5664;53,2,1,3776;264,5,1,559",0,1,1,10,2,0,4,0,0
0, Membuat Sarung Tangan Kristal Tahap 3 ,2,recipe-icon-147,147,3,"208,2;212,1;215,1", Tahap 3 Resipi Kasut Pahlawan Kasut Spar ,"54,1,1,4525;54,2,1,3016;54,3,1,2011;276,5,1,446",0,1,1,10,2,0,4,0,5
0, Membuat Intipati Pertempuran Tahap 1 ,2,recipe-icon-149,149,1,"30,5;31,5;32,5", Tahap 1 Resipi Batu ,"216,1,1,10000",0,1,1,10,2,0,4,0,0
0, Membuat Intipati Pertempuran Tahap 2 ,2,recipe-icon-150,150,2,"33,5;35,5;34,5;216,2", Tahap 2 Resipi Bijih Besi Hitam ,"217,1,1,10000",0,1,1,10,2,0,4,0,0
0, Membuat Intipati Pertempuran Tahap 3 ,2,recipe-icon-151,151,3,"36,5;37,5;38,5;217,2", Tahap 3 Resipi Lombong Kristal Merah ,"218,1,1,10000",0,1,1,10,2,0,4,0,0
0, Membuat Intipati Pertanian Tahap 1 ,2,recipe-icon-152,152,1,"70,5;71,5;72,5", Tahap 1 Resipi Tanah Liat ,"210,1,1,10000",0,1,1,10,1,0,4,0,0
0, Membuat Intipati Pertanian Tahap 2 ,2,recipe-icon-153,153,2,"74,5;73,5;75,5;210,2", Tahap 1 Resipi Kayu Biasa ,"211,1,1,10000",0,1,1,10,1,0,4,0,0
0, Membuat Intipati Pertanian Tahap 3 ,2,recipe-icon-154,154,3,"76,5;77,5;78,5;211,2", Tahap 1 Resipi Kayu Pokok Padang Pasir ,"212,1,1,10000",0,1,1,10,1,0,4,0,0
0, Membuat Intipati Ternakan Pertanian Tahap 1 ,2,recipe-icon-155,155,1,"178,5;179,5;177,5", Tahap 1 Resipi Kayu Gelap ,"213,1,1,10000",0,1,1,10,1,0,4,0,0
0, Membuat Intipati Ternakan Pertanian Tahap 2 ,2,recipe-icon-156,156,2,"182,5;180,5;181,5;213,2", Tahap 1 Resipi Damar ,"214,1,1,10000",0,1,1,10,1,0,4,0,0
0, Membuat Intipati Ternakan Pertanian Tahap 3 ,2,recipe-icon-157,157,3,"184,5;185,5;183,5;214,2", Tahap 1 Resipi Gentian Tumbuhan ,"215,1,1,10000",0,1,1,10,1,0,4,0,0
0, Membuat Intipati Mengumpul Tahap 1 ,2,recipe-icon-158,158,1,"62,5;58,5;66,5", Tahap 1 Resipi Cendawan Ais ,"207,1,1,10000",0,1,1,10,3,0,4,0,0
0, Membuat Intipati Mengumpul Tahap 2 ,2,recipe-icon-159,159,2,"63,5;67,5;59,5;207,2", Tahap 1 Resipi Tequila ,"208,1,1,10000",0,1,1,10,3,0,4,0,0
0, Membuat Intipati Mengumpul Tahap 3 ,2,recipe-icon-160,160,3,"64,5;60,5;68,5;208,2", Tahap 1 Resipi Sarang Lelabah ,"209,1,1,10000",0,1,1,10,3,0,4,0,0
0, Membuat Baju Atasan Pertanian Tahap 1 ,2,recipe-icon-165,165,1,"207,2", Tahap 1 Resipi Baju Atasan Pertanian ,"101,1,1,9101;268,5,1,898",0,2,1,10,1,0,4,0,0
0, Membuat Seluar Pertanian Tahap 1 ,2,recipe-icon-166,166,1,"207,2", Tahap 1 Resipi Seluar Pertanian ,"104,1,1,9101;270,5,1,898",0,2,1,10,1,0,4,0,0
0, Membuat Sarung Tangan Pertanian Tahap 1 ,2,recipe-icon-167,167,1,"207,2", Tahap 1 Resipi Sarung Tangan Pertanian ,"107,1,1,9101;269,5,1,898",0,2,1,10,1,0,4,0,0
0, Membuat Kasut Pertanian Tahap 1 ,2,recipe-icon-168,168,1,"207,2", Tahap 1 Resipi Kasut Pertanian ,"110,1,1,9101;271,5,1,898",0,2,1,10,1,0,4,0,0
0, Membuat Baju Atasan Pertanian Tahap 2 ,2,recipe-icon-169,169,2,"216,2;208,2", Tahap 1 Resipi Baju Atasan Pertanian ,"102,1,1,5664;102,2,1,3776;263,5,1,559",0,2,1,10,1,0,4,0,0
0, Membuat Seluar Pertanian Tahap 2 ,2,recipe-icon-170,170,2,"216,2;208,2", Tahap 2 Resipi Seluar Pertanian ,"105,1,1,5664;105,2,1,3776;265,5,1,559",0,2,1,10,1,0,4,0,0
0, Membuat Sarung Tangan Pertanian Tahap 2 ,2,recipe-icon-171,171,2,"216,2;208,2", Tahap 2 Resipi Sarung Tangan Pertanian ,"108,1,1,5664;108,2,1,3776;264,5,1,559",0,2,1,10,1,0,4,0,0
0, Membuat Kasut Pertanian Tahap 2 ,2,recipe-icon-172,172,2,"216,2;208,2", Tahap 2 Resipi Kasut Pertanian ,"111,1,1,5664;111,2,1,3776;266,5,1,559",0,2,1,10,1,0,4,0,0
0, Membuat Baju Atasan Pertanian Tahap 3 ,2,recipe-icon-173,173,3,"217,2;209,2", Tahap 3 Resipi Baju Atasan Pertanian ,"103,1,1,4525;103,2,1,3016;103,3,1,2011;273,5,1,446",0,2,1,10,1,0,4,0,5
0, Membuat Seluar Pertanian Tahap 3 ,2,recipe-icon-174,174,3,"217,2;209,2", Tahap 3 Resipi Seluar Pertanian ,"106,1,1,4525;106,3,1,2011;106,2,1,3016;275,5,1,446",0,2,1,10,1,0,4,0,5
0, Membuat Sarung Tangan Pertanian Tahap 3 ,2,recipe-icon-175,175,3,"217,2;209,2", Tahap 3 Resipi Sarung Tangan Pertanian ,"109,2,1,3016;109,1,1,4525;109,3,1,2011;274,5,1,446",0,2,1,10,1,0,4,0,5
0, Membuat Kasut Pertanian Tahap 3 ,2,recipe-icon-176,176,3,"217,2;209,2", Tahap 3 Resipi Kasut Pertanian ,"112,1,1,4525;112,3,1,2011;112,2,1,3016;276,5,1,446",0,2,1,10,1,0,4,0,5
0, Membuat Kasut Koleksi Tahap 1 ,2,recipe-icon-177,177,1,"216,2", Tahap 1 Resipi Kasut Koleksi ,"113,1,1,9101;271,5,1,898",0,2,1,10,3,0,4,0,0
0, Membuat Baju Atasan Koleksi Tahap 1 ,2,recipe-icon-178,178,1,"216,2", Tahap 1 Resipi Baju Atasan Koleksi ,"119,1,1,9101;268,5,1,898",0,2,1,10,3,0,4,0,0
0, Membuat Seluar Koleksi Tahap 1 ,2,recipe-icon-179,179,1,"216,2", Tahap 1 Resipi Seluar Koleksi ,"122,1,1,9101;270,5,1,898",0,2,1,10,3,0,4,0,0
0, Membuat Sarung Tangan Koleksi Tahap 1 ,2,recipe-icon-180,180,1,"216,2", Tahap 1 Resipi Sarung Tangan Koleksi ,"125,1,1,9101;269,5,1,898",0,2,1,10,3,0,4,0,0
0, Membuat Kasut Koleksi Tahap 2 ,2,recipe-icon-181,181,2,"210,1;213,1;217,2", Tahap 2 Resipi Kasut Koleksi ,"114,1,1,5664;114,2,1,3776;266,5,1,559",0,2,1,10,3,0,4,0,0
0, Membuat Baju Atasan Koleksi Tahap 2 ,2,recipe-icon-182,182,2,"210,1;213,1;217,2", Tahap 2 Resipi Baju Atasan Koleksi ,"120,1,1,5664;120,2,1,3776;263,5,1,559",0,2,1,10,3,0,4,0,0
0, Membuat Seluar Koleksi Tahap 2 ,2,recipe-icon-183,183,2,"210,1;213,1;217,2", Tahap 2 Resipi Seluar Koleksi ,"123,1,1,5664;123,2,1,3776;265,5,1,559",0,2,1,10,3,0,4,0,0
0, Membuat Sarung Tangan Koleksi Tahap 2 ,2,recipe-icon-184,184,2,"210,1;213,1;217,2", Tahap 2 Resipi Sarung Tangan Koleksi ,"126,1,1,5664;126,2,1,3776;264,5,1,559",0,2,1,10,3,0,4,0,0
0, Membuat Kasut Koleksi Tahap 3 ,2,recipe-icon-185,185,3,"211,1;214,1;218,2", Tahap 3 Resipi Kasut Koleksi ,"115,1,1,4525;115,3,1,2011;115,2,1,3016;276,5,1,446",0,2,1,10,3,0,4,0,5
0, Membuat Baju Atasan Koleksi Tahap 3 ,2,recipe-icon-186,186,3,"211,1;214,1;218,2", Tahap 3 Resipi Baju Atasan Koleksi ,"121,1,1,4525;121,3,1,2011;121,2,1,3016;273,5,1,446",0,2,1,10,3,0,4,0,5
0, Membuat Seluar Koleksi Tahap 3 ,2,recipe-icon-187,187,3,"211,1;214,1;218,2", Tahap 3 Resipi Seluar Koleksi ,"124,1,1,4525;124,3,1,2011;124,2,1,3016;275,5,1,446",0,2,1,10,3,0,4,0,5
0, Membuat Sarung Tangan Koleksi Tahap 3 ,2,recipe-icon-188,188,3,"211,1;214,1;218,2", Tahap 3 Resipi Sarung Tangan Koleksi ,"127,1,1,4525;127,2,1,3016;127,3,1,2011;274,5,1,446",0,2,1,10,3,0,4,0,5
0, Membuat Pedang Kayu Tahap 0 ,2,recipe-icon-189,189,0,"62,10;32,5", Tahap 1 Resipi Buluh ,"39,1,1,10000",0,1,1,3,2,1,1,0,0
0, Membuat Cangkul Kayu Tahap 0 ,2,recipe-icon-190,190,0,"62,10;66,10", Tahap 1 Resipi Semanggi ,"79,1,1,10000",0,1,1,3,1,1,1,0,0
0, Membuat Berus Tahap 0 ,2,recipe-icon-191,191,0,"62,10;66,10", Tahap 1 Resipi Lobak Merah ,"95,1,1,10000",0,1,1,3,1,1,1,0,0
0, Membuat Gunting Rambut Tahap 0 ,2,recipe-icon-192,192,0,"62,10;66,10", Tahap 2 Resipi Nepenthes ,"96,1,1,10000",0,1,1,3,1,1,1,0,0
0, Membuat Mesin Perah Susu Tahap 0 ,2,recipe-icon-193,193,0,"62,10;66,10", Tahap 1 Resipi Kapas ,"97,1,1,10000",0,1,1,3,1,1,1,0,0
0, Membuat Botol Air Kayu Tahap 0 ,2,recipe-icon-194,194,0,"62,10;66,10", Tahap 1 Resipi Buah Kesabaran ,"83,1,1,10000",0,1,1,3,1,1,1,0,0
0, Membuat Kapak Kayu Tahap 0 ,2,recipe-icon-195,195,0,"62,10;66,10", Tahap 3 Resipi Cili Api ,"91,1,1,10000",0,1,1,3,3,1,1,0,0
0, Membuat Beliung Kayu Tahap 0 ,2,recipe-icon-196,196,0,"62,10;66,10", Tahap 1 Resipi Buah Keras ,"87,1,1,10000",0,1,1,10,3,1,1,0,0
0, Membuat Baja Dipercepat yang Lebih Baik Tahap 0 ,2,recipe-icon-197,197,2,"69,2;35,2", Tahap 0 Resipi Baja Dipercepatkan yang Lebih Baik ,"219,1,1,10000",0,3,1,10,1,0,4,0,0
0, Membuat Baja yang Meningkatkan Hasil yang Lebih Baik Tahap 0 ,2,recipe-icon-198,198,2,"61,2;35,2", Tahap 0 Resipi Baja yang Meningkatkan Hasil yang Lebih Baik ,"220,1,1,10000",0,3,1,10,1,0,4,0,0
0, Membuat Baja yang Melembapkan yang Lebih Baik Tahap 0 ,2,recipe-icon-199,199,2,"65,2;35,2", Tahap 0 Resipi Baja yang Melembapkan yang Lebih Baik ,"221,1,1,10000",0,3,1,10,1,0,4,0,0
0, Membuat Sabit Batu Tahap 1 ,2,recipe-icon-201,201,1,"62,10;58,10", Tahap 1 Resipi Sabit Batu ,"226,1,1,10000",0,1,1,10,3,0,4,0,0
0, Membuat Sabit Tembaga Tahap 2 ,2,recipe-icon-203,203,2,"216,2", Tahap 2 Resipi Sabit Tembaga ,"227,1,1,10000",0,1,1,10,3,0,4,0,0
0, Membuat Sabit Besi Tahap 3 ,2,recipe-icon-204,204,3,"217,2;210,1;213,1", Tahap 3 Resipi Sabit Besi ,"228,1,1,10000",0,1,1,10,3,0,4,0,5
0, Membuat Suapan Kecil Tahap 0 ,2,recipe-icon-205,205,0,"66,5;62,5", Tahap 1 Resipi Biji Cendawan Hantu Biru ,"28,1,1,10000",0,1,1,10,1,1,1,0,0
0, Membuat Suapan Besar Tahap 0 ,2,recipe-icon-206,206,1,"63,5;67,5", Tahap 0 Resipi Cangkul Kayu ,"29,1,1,10000",0,1,1,10,1,0,4,0,0
0, Membuat Busur Kayu Tahap 0 ,2,recipe-icon-207,207,0,"62,20;66,10", Tahap 0 Resipi Cangkul Besi ,"223,1,1,10000",0,1,1,10,2,1,1,0,0
0, Membuat Tukul Batu Tahap 0 ,2,recipe-icon-208,208,0,"62,20;58,20", Tahap 0 Resipi Cangkul Terkutuk ,"222,1,1,10000",0,1,1,10,2,1,1,0,0
0,Kosong,2,recipe-icon-212,212,0,"62,3", Tahap 0 Resipi Cangkul yang Diberkati ,"232,1,1,10000",0,1,1,10,3,0,4,0,0
0,Kosong,2,recipe-icon-213,213,0,"58,3", Tahap 0 Resipi Cerek Kayu ,"233,1,1,10000",0,1,1,10,3,0,4,0,0
0,Kosong,2,recipe-icon-214,214,0,"66,3", Tahap 0 Resipi Cerek Besi ,"234,1,1,10000",0,1,1,10,3,0,4,0,0
0,Kosong,2,recipe-icon-215,215,0,"65,1;61,1;69,1", Tahap 0 Resipi Cerek Terkutuk ,"235,1,3,10000",0,1,1,10,3,1,1,0,0
0,Kosong,2,recipe-icon-216,216,0,"32,3;70,3", Tahap 0 Resipi Cerek yang Diberkati ,"236,1,1,10000",0,1,1,10,3,1,1,0,0
0,Kosong,2,recipe-icon-217,217,0,"31,3;71,3", Tahap 0 Resipi Beliung Kayu ,"237,1,1,10000",0,1,1,10,3,1,1,0,0
0,Kosong,2,recipe-icon-218,218,0,"30,3;72,3", Tahap 0 Resipi Beliung Besi ,"238,1,1,10000",0,1,1,10,3,1,1,0,0
0,Resipi Pemulihan Tenaga - Kecil,2,recipe-icon-267,267,0,"66,20;62,5", Resipi Penyembuhan Tenaga - Kecil ,"295,1,1,10000",0,1,1,10,3,0,4,0,0
0,Resipi Pemulihan Tenaga - Sederhana,2,recipe-icon-268,268,1,"67,10;63,5", Resipi Penyembuhan Tenaga - Sederhana ,"296,1,1,10000",0,1,1,10,3,0,4,0,0
0,Resipi Pemulihan Tenaga - Besar,2,recipe-icon-269,269,2,"64,5", Resipi Penyembuhan Tenaga - Besar ,"297,1,1,10000",0,1,1,10,3,0,4,0,0
0,Resipi Pedang Emas,2,recipe-icon-270,270,4,"209,2;407,1;410,1", Resipi Pedang Emas ,"317,1,1,4153;317,2,1,2769;317,3,1,1846;317,4,1,1230",0,3,1,30,2,0,4,0,10
0,Resipi Topi Pejuang Emas,2,recipe-icon-271,271,4,"209,2;407,1;410,1", Resipi Topi Pejuang Emas ,"335,1,1,3990;335,2,1,2660;335,3,1,1773;335,4,1,1182;241,5,1,394",0,2,1,30,2,0,4,0,10
0,Resipi Kot Pejuang Emas,2,recipe-icon-272,272,4,"209,2;407,1;410,1", Resipi Kot Pejuang Emas ,"336,1,1,3990;336,2,1,2660;336,3,1,1773;336,4,1,1182;242,5,1,394",0,2,1,30,2,0,4,0,10
0,Resipi Sarung Tangan Pejuang Emas,2,recipe-icon-273,273,4,"209,2;407,1;410,1", Resipi Sarung Tangan Pejuang Emas ,"337,1,1,3990;337,2,1,2660;337,3,1,1773;337,4,1,1182;243,5,1,394",0,2,1,30,2,0,4,0,10
0,Resipi Seluar Pejuang Emas,2,recipe-icon-274,274,4,"209,2;407,1;410,1", Resipi Seluar Pejuang Emas ,"338,1,1,3990;338,2,1,2660;338,3,1,1773;338,4,1,1182;244,5,1,394",0,2,1,30,2,0,4,0,10
0,Resipi Kasut Pejuang Emas,2,recipe-icon-275,275,4,"209,2;407,1;410,1", Resipi Kasut Pejuang Emas ,"339,1,1,3990;339,2,1,2660;339,3,1,1773;339,4,1,1182;245,5,1,394",0,2,1,30,2,0,4,0,10
0,Resipi Sabit Emas,2,recipe-icon-276,276,4,"212,1;215,1;401,2", Resipi Sabit Emas ,"303,1,1,4153;303,2,1,2769;303,3,1,1846;303,4,1,1230",0,3,1,30,3,0,4,0,10
0,Resipi Kapak Emas,2,recipe-icon-277,277,4,"212,1;215,1;401,2", Resipi Kapak Emas ,"300,1,1,4153;300,2,1,2769;300,3,1,1846;300,4,1,1230",0,3,1,30,3,0,4,0,10
0,Resipi Topi Kumpul Emas,2,recipe-icon-279,279,4,"212,1;215,1;401,2", Resipi Topi Kumpul Emas ,"320,1,1,3990;320,2,1,2660;320,3,1,1773;320,4,1,1182;241,5,1,394",0,2,1,30,3,0,4,0,10
0,Resipi Beliung Emas,2,recipe-icon-278,278,4,"212,1;215,1;401,2", Resipi Beliung Emas ,"301,1,1,4153;301,2,1,2769;301,3,1,1846;301,4,1,1230",0,3,1,30,3,0,4,0,10
0,Resipi Kot Kumpul Emas,2,recipe-icon-280,280,4,"212,1;215,1;401,2", Resipi Kot Kumpul Emas ,"321,1,1,3990;321,2,1,2660;321,3,1,1773;321,4,1,1182;242,5,1,394",0,2,1,30,3,0,4,0,10
0,Resipi Sarung Tangan Kumpul Emas,2,recipe-icon-281,281,4,"212,1;215,1;401,2", Resipi Sarung Tangan Kumpul Emas ,"322,1,1,3990;322,2,1,2660;322,3,1,1773;322,4,1,1182;243,5,1,394",0,2,1,30,3,0,4,0,10
0,Resipi Cangkul Emas,2,recipe-icon-282,282,4,"218,2;404,2", Resipi Cangkul Emas ,"299,1,1,4153;299,2,1,2769;299,3,1,1846;299,4,1,1230",0,3,1,30,1,0,4,0,10
0,Resipi Topi Petani Emas,2,recipe-icon-284,284,4,"218,2;404,2", Resipi Topi Petani Emas ,"350,1,1,3990;350,2,1,2660;350,3,1,1773;350,4,1,1182;241,5,1,394",0,2,1,30,1,0,4,0,10
0,Resipi Kot Petani Emas,2,recipe-icon-285,285,4,"218,2;404,2", Resipi Kot Petani Emas ,"351,1,1,3990;351,2,1,2660;351,3,1,1773;351,4,1,1182;243,5,1,394",0,2,1,30,1,0,4,0,10
0,Resipi Sarung Tangan Petani Emas,2,recipe-icon-286,286,4,"218,2;404,2", Resipi Sarung Tangan Petani Emas ,"352,1,1,3990;352,2,1,2660;352,3,1,1773;352,4,1,1182;242,5,1,394",0,2,1,30,1,0,4,0,10
0,Resipi Seluar Petani Emas,2,recipe-icon-287,287,4,"218,2;404,2", Resipi Seluar Petani Emas ,"353,1,1,3990;353,2,1,2660;353,3,1,1773;353,4,1,1182;244,5,1,394",0,2,1,30,1,0,4,0,10
0,Resipi Seluar Kumpul Emas,2,recipe-icon-288,288,4,"212,1;215,1;401,2", Resipi Seluar Kumpul Emas ,"323,1,1,3990;323,2,1,2660;323,3,1,1773;323,4,1,1182;244,5,1,394",0,2,1,30,3,0,4,0,10
0,Resipi Kasut Kumpul Emas,2,recipe-icon-289,289,4,"212,1;215,1;401,2", Resipi Kasut Kumpul Emas ,"324,1,1,3990;324,2,1,2660;324,3,1,1773;324,4,1,1182;245,5,1,394",0,2,1,30,3,0,4,0,10
0,Resipi Kasut Petani Emas,2,recipe-icon-291,291,4,"218,2;404,2", Resipi Kasut Petani Emas ,"354,1,1,3990;354,2,1,2660;354,3,1,1773;354,4,1,1182;245,5,1,394",0,2,1,30,1,0,4,0,10
0,Resipi Pedang Berlian,2,recipe-icon-292,292,5,"404,2;408,1;411,1", Resipi Pedang Berlian ,"318,1,1,3990;318,2,1,2660;318,3,1,1773;318,4,1,1182;318,5,1,394",0,3,1,90,2,0,4,0,15
0,Resipi Topi Pejuang Berlian,2,recipe-icon-293,293,5,"404,2;408,1;411,1", Resipi Topi Pejuang Berlian ,"340,1,1,3838;340,2,1,2559;340,3,1,1706;340,4,1,1137;340,5,1,379;277,5,1,379",0,2,1,90,2,0,4,0,15
0,Resipi Kot Pejuang Berlian,2,recipe-icon-294,294,5,"404,2;408,1;411,1", Resipi Kot Pejuang Berlian ,"341,1,1,3838;341,2,1,2559;341,3,1,1706;341,4,1,1137;341,5,1,379;278,5,1,379",0,2,1,90,2,0,4,0,15
0,Resipi Sarung Tangan Pejuang Berlian,2,recipe-icon-295,295,5,"404,2;408,1;411,1", Resipi Sarung Tangan Pejuang Berlian ,"342,1,1,3838;342,2,1,2559;342,3,1,1706;342,4,1,1137;342,5,1,379;279,5,1,379",0,2,1,90,2,0,4,0,15
0,Resipi Seluar Pejuang Berlian,2,recipe-icon-296,296,5,"404,2;408,1;411,1", Resipi Seluar Pejuang Berlian ,"343,1,1,3838;343,2,1,2559;343,3,1,1706;343,4,1,1137;343,5,1,379;280,5,1,379",0,2,1,90,2,0,4,0,15
0,Resipi Kasut Pejuang Berlian,2,recipe-icon-297,297,5,"404,2;408,1;411,1", Resipi Kasut Pejuang Berlian ,"344,1,1,3838;344,2,1,2559;344,3,1,1706;344,4,1,1137;344,5,1,379;281,5,1,379",0,2,1,90,2,0,4,0,15
0,Resipi Sabit Berlian,2,recipe-icon-298,298,5,"407,1;410,1;402,2", Resipi Sabit Berlian ,"309,1,1,3990;309,2,1,2660;309,3,1,1773;309,4,1,1182;309,5,1,394",0,3,1,90,3,0,4,0,15
0,Resipi Kapak Berlian,2,recipe-icon-299,299,5,"407,1;410,1;402,2", Resipi Kapak Berlian ,"306,1,1,3990;306,2,1,2660;306,3,1,1773;306,4,1,1182;306,5,1,394",0,3,1,90,3,0,4,0,15
0,Resipi Beliung Berlian,2,recipe-icon-300,300,5,"407,1;410,1;402,2", Resipi Beliung Berlian ,"307,1,1,3990;307,2,1,2660;307,3,1,1773;307,4,1,1182;307,5,1,394",0,3,1,90,3,0,4,0,15
0,Resipi Topi Kumpul Berlian,2,recipe-icon-301,301,5,"407,1;410,1;402,2", Resipi Topi Kumpul Berlian ,"325,1,1,3838;325,2,1,2559;325,3,1,1706;325,4,1,1137;325,5,1,379;277,5,1,379",0,2,1,90,3,0,4,0,15
0,Resipi Kot Kumpul Berlian,2,recipe-icon-302,302,5,"407,1;410,1;402,2", Resipi Kot Kumpul Berlian ,"326,1,1,3838;326,2,1,2559;326,3,1,1706;326,4,1,1137;326,5,1,379;278,5,1,379",0,2,1,90,3,0,4,0,15
0,Resipi Sarung Tangan Kumpul Berlian,2,recipe-icon-303,303,5,"407,1;410,1;402,2", Resipi Sarung Tangan Kumpul Berlian ,"327,1,1,3838;327,2,1,2559;327,3,1,1706;327,4,1,1137;327,5,1,379;279,5,1,379",0,2,1,90,3,0,4,0,15
0,Resipi Seluar Kumpul Berlian,2,recipe-icon-304,304,5,"407,1;410,1;402,2", Resipi Seluar Kumpul Berlian ,"328,1,1,3838;328,2,1,2559;328,3,1,1706;328,4,1,1137;328,5,1,379;280,5,1,379",0,2,1,90,3,0,4,0,15
0,Resipi Kasut Kumpul Berlian,2,recipe-icon-305,305,5,"407,1;410,1;402,2", Resipi Kasut Kumpul Berlian ,"329,1,1,3838;329,2,1,2559;329,3,1,1706;329,4,1,1137;329,5,1,379;281,5,1,379",0,2,1,90,3,0,4,0,15
0,Resipi Cangkul Berlian,2,recipe-icon-306,306,5,"401,2;405,2", Resipi Cangkul Berlian ,"305,1,1,3990;305,2,1,2660;305,3,1,1773;305,4,1,1182;305,5,1,394",0,3,1,90,1,0,4,0,15
0,Resipi Topi Petani Berlian,2,recipe-icon-308,308,5,"401,2;405,2", Resipi Topi Petani Berlian ,"355,1,1,3838;355,2,1,2559;355,3,1,1706;355,4,1,1137;355,5,1,379;277,5,1,379",0,2,1,90,1,0,4,0,15
