classifyLevel-int,desc-string,displayType-int,icon-string,id-int,level-int,matItemId-int[][],name-string,productId-int[][],proficiency-int,recipesSort-int,sourceText-int,timeCost-int,timesLimit-int,type-int,unlockCondition-int,unlockType-int,useDitamin-int,useToken-int
0,Tukar semula Baju Serpihan Kristal Retak Anda,2,recipe-icon-446,446,1,"46,1;213,1;210,1", Tahap 1 Penyelenggaraan Semula Baju Pahlawan Serpihan Kristal ,"46,1,1,10000",0,99446,1,10,-,2,0,4,0,0
0,Ubahsuai semula Kasut Petani Berlian Anda,2,recipe-icon-533,533,5,"359,1;404,2", Tahap 5 Penukaran Semula Kasut Petani Berlian,"359,1,1,3990;359,2,1,2660;359,3,1,1773;359,4,1,1182;359,5,1,394",0,95533,1,10,-,1,0,4,0,15
0,Tukar semula Cerek Besi Anda,2,recipe-icon-437,437,1,"216,2;84,1", Tahap 1 Penyelenggaraan Semula Cerek Besi ,"84,1,1,10000",0,99437,1,10,-,3,0,4,0,0
0,Ubahsuai semula Kot Petani Berlian Anda,2,recipe-icon-545,545,5,"356,1;404,2", Pemprosesan Semula Baju Tani Berlian Tahap 5,"356,1,1,3990;356,2,1,2660;356,3,1,1773;356,4,1,1182;356,5,1,394",0,95545,1,10,-,1,0,4,0,15
0,Tukar semula Kot Pertanian Emas Anda,2,recipe-icon-520,520,4,"351,1;209,2", Tahap 4 Penyucian semula Kot Petani Emas,"351,1,1,4153;351,2,1,2769;351,3,1,1846;351,4,1,1230",0,96520,1,10,-,1,0,4,0,10
0,Tukar semula Sarung Tangan Pejuang Emas Anda,2,recipe-icon-511,511,4,"337,1;215,1;212,1", Tahap 4 Penukaran Semula Sarung Tangan Pejuang Emas,"337,1,1,4153;337,2,1,2769;337,3,1,1846;337,4,1,1230",0,96511,1,10,-,2,0,4,0,10
0,Tukar semula Kot Mengumpul Emas Anda,2,recipe-icon-515,515,4,"321,1;218,2", Tahap 4 Penukaran Semula Kot Kumpul Emas,"321,1,1,4153;321,2,1,2769;321,3,1,1846;321,4,1,1230",0,96515,1,10,-,3,0,4,0,10
0,Tukar semula Kasut Mengumpul Emas Anda,2,recipe-icon-516,516,4,"324,1;218,2", Tahap 4 Penukaran Semula Kasut Kumpul Emas,"324,1,1,4153;324,2,1,2769;324,3,1,1846;324,4,1,1230",0,96516,1,10,-,3,0,4,0,10
0,Tukar semula Sarung Tangan Kulit Kristal Anda,2,recipe-icon-469,469,2,"53,1;213,1;210,1",Pemprosesan semula Sarung Tangan Kulit Kristal Lv 2,"53,1,1,6000;53,2,1,4000",0,98469,1,10,-,2,0,4,0,0
0,Ubahsuai semula Seluar Petani Bintang Anda,2,recipe-icon-560,560,6,"363,1;405,2", Pemprosesan Semula Seluar Tani Bintang Tahap 6,"363,1,1,3990;363,2,1,2660;363,3,1,1773;363,4,1,1182;363,5,1,394",0,94560,1,10,-,1,0,4,0,20
0,Tukar semula Cerek Terkutuk Anda,2,recipe-icon-463,463,2,"85,1;207,2",Pemprosesan semula Cerek Terkutuklah Lv 2,"85,1,1,6000;85,2,1,4000",0,98463,1,10,-,1,0,4,0,0
0,Ubahsuai semula Pedang Bintang Anda,2,recipe-icon-561,561,6,"319,1;411,1;408,1", Perubahan semula Pedang Bintang Lv 6,"319,1,1,3990;319,2,1,2660;319,3,1,1773;319,4,1,1182;319,5,1,394",0,94561,1,10,-,2,0,4,0,20
0,Tukar semula Cerek Emas Anda,2,recipe-icon-528,528,4,"304,1;209,2", Tahap 4 Penukaran Semula Cerek Emas,"304,1,1,4153;304,2,1,2769;304,3,1,1846;304,4,1,1230",0,96528,1,10,-,1,0,4,0,10
0,Tukar semula Kasut Pertanian Anda,2,recipe-icon-472,472,2,"111,1;207,2",Pemprosesan semula Kasut Pertanian Lv 2,"111,1,1,6000;111,2,1,4000",0,98472,1,10,-,1,0,4,0,0
0,Tukar semula Sabit Kristal Anda,2,recipe-icon-483,483,3,"228,1;217,2", Tahap 3 Penyucian semula Sabit Kristal,"228,1,1,4736;228,2,1,3157;228,3,1,2105",0,97483,1,10,-,3,0,4,0,0
0,Tukar semula Topi Daun Beruntung Anda,2,recipe-icon-457,457,1,"216,2;98,1", Tahap 1 Penyelenggaraan Semula Topi Daun Beruntung ,"98,1,1,10000",0,99457,1,10,-,3,0,4,0,0
0,Tukar semula Topi Mengumpul Anda,2,recipe-icon-485,485,3,"217,2;118,1", Tahap 3 Penyucian semula Topi Mengumpul,"118,1,1,4736;118,2,1,3157;118,3,1,2105",0,97485,1,10,-,3,0,4,0,0
0,Tukar semula Kasut Pertanian Emas Anda,2,recipe-icon-510,510,4,"354,1;209,2", Tahap 4 Penukaran Semula Kasut Petani Emas,"354,1,1,4153;354,2,1,2769;354,3,1,1846;354,4,1,1230",0,96510,1,10,-,1,0,4,0,10
0,Tukar semula Topi Mengumpul Emas Anda,2,recipe-icon-525,525,4,"320,1;218,2", Tahap 4 Penukaran Semula Topi Kumpul Emas,"320,1,1,4153;320,2,1,2769;320,3,1,1846;320,4,1,1230",0,96525,1,10,-,3,0,4,0,10
0,Ubahsuai semula Cerek Bintang Anda,2,recipe-icon-563,563,6,"316,1;405,2", Perubahan semula Cerek Bintang Lv 6,"316,1,1,3990;316,2,1,2660;316,3,1,1773;316,4,1,1182;316,5,1,394",0,94563,1,10,-,1,0,4,0,20
0,Tukar semula Sarung Tangan Mengumpul Emas Anda,2,recipe-icon-524,524,4,"322,1;218,2", Tahap 4 Penukaran Semula Sarung Tangan Kumpul Emas,"322,1,1,4153;322,2,1,2769;322,3,1,1846;322,4,1,1230",0,96524,1,10,-,3,0,4,0,10
0,Tukar semula Sabit Tembaga Anda,2,recipe-icon-455,455,1,"226,1;216,2", Tahap 1 Penyelenggaraan Semula Sabit Tembaga ,"226,1,1,10000",0,99455,1,10,-,3,0,4,0,0
0,Ubahsuai semula Topi Pengumpul Bintang Anda,2,recipe-icon-557,557,6,"330,1;402,2", Perubahan semula Topi Pengumpul Bintang Lv 6,"330,1,1,3990;330,2,1,2660;330,3,1,1773;330,4,1,1182;330,5,1,394",0,94557,1,10,-,3,0,4,0,20
0,Tukar semula Beliung Besi Anda,2,recipe-icon-445,445,1,"216,2;88,1", Tahap 1 Penyelenggaraan Semula Beliung Besi ,"88,1,1,10000",0,99445,1,10,-,1,0,4,0,0
0,Tukar semula Sarung Tangan Pertanian Anda,2,recipe-icon-448,448,1,"107,1;207,2", Tahap 1 Penyelenggaraan Semula Sarung Tangan Pertanian ,"107,1,1,10000",0,99448,1,10,-,1,0,4,0,0
0,Ubahsuai semula Kasut Pengumpul Berlian Anda,2,recipe-icon-538,538,5,"329,1;401,2", Pemprosesan Semula Kasut Kumpul Berlian Tahap 5,"329,1,1,3990;329,2,1,2660;329,3,1,1773;329,4,1,1182;329,5,1,394",0,95538,1,10,-,3,0,4,0,15
0,Ubahsuai semula Sarung Tangan Pengumpul Bintang Anda,2,recipe-icon-554,554,6,"332,1;402,2", Perubahan semula Sarung Tangan Pengumpul Bintang Lv 6,"332,1,1,3990;332,2,1,2660;332,3,1,1773;332,4,1,1182;332,5,1,394",0,94554,1,10,-,3,0,4,0,20
0,Ubahsuai semula Beliung Bintang Anda,2,recipe-icon-565,565,6,"313,1;402,2", Perubahan semula Beliung Bintang Lv 6,"313,1,1,3990;313,2,1,2660;313,3,1,1773;313,4,1,1182;313,5,1,394",0,94565,1,10,-,3,0,4,0,20
0,Tukar semula Gelang Serpihan Kristal Retak Anda,2,recipe-icon-443,443,1,"52,1;213,1;210,1", Tahap 1 Penyelenggaraan Semula Gelang Pahlawan Serpihan Kristal ,"52,1,1,10000",0,99443,1,10,-,2,0,4,0,0
0,Tukar semula Palu Tembaga Anda,2,recipe-icon-456,456,1,"441,1;213,1;210,1", Tahap 1 Penyelenggaraan Semula Palu Tembaga ,"441,1,1,10000",0,99456,1,10,-,2,0,4,0,0
0,Ubahsuai semula Sabit Berlian Anda,2,recipe-icon-577,577,5,"309,1;401,2", Pemprosesan Semula Sabit Berlian Tahap 5,"309,1,1,3990;309,2,1,2660;309,3,1,1773;309,4,1,1182;309,5,1,394",0,95577,1,10,-,3,0,4,0,15
0,Tukar semula Cangkul Emas Anda,2,recipe-icon-507,507,4,"299,1;209,2", Tahap 4 Penukaran Semula Cangkul Emas,"299,1,1,4153;299,2,1,2769;299,3,1,1846;299,4,1,1230",0,96507,1,10,-,1,0,4,0,10
0,Ubahsuai semula Topi Petani Berlian Anda,2,recipe-icon-549,549,5,"355,1;404,2", Pemprosesan Semula Topi Tani Berlian Tahap 5,"355,1,1,3990;355,2,1,2660;355,3,1,1773;355,4,1,1182;355,5,1,394",0,95549,1,10,-,1,0,4,0,15
0,Ubahsuai semula Topi Pejuang Berlian Anda,2,recipe-icon-535,535,5,"340,1;410,1;407,1", Pemprosesan Semula Topi Pahlawan Berlian Tahap 5,"340,1,1,3990;340,2,1,2660;340,3,1,1773;340,4,1,1182;340,5,1,394",0,95535,1,10,-,2,0,4,0,15
0,Tukar semula Sikat Kristal Anda,2,recipe-icon-490,490,3,"455,1;208,2", Tahap 3 Penyucian semula Berus Kristal,"455,1,1,4736;455,2,1,3157;455,3,1,2105",0,97490,1,10,-,1,0,4,0,0
0,Tukar semula Skirt Hula Kristal Retak Anda,2,recipe-icon-447,447,1,"49,1;213,1;210,1", Tahap 1 Penyelenggaraan Semula Skirt Hula Pahlawan Pecah Kristal ,"49,1,1,10000",0,99447,1,10,-,2,0,4,0,0
0,Ubahsuai semula Cangkul Bintang Anda,2,recipe-icon-564,564,6,"311,1;405,2", Perubahan semula Cangkul Bintang Lv 6,"311,1,1,3990;311,2,1,2660;311,3,1,1773;311,4,1,1182;311,5,1,394",0,94564,1,10,-,1,0,4,0,20
0,Tukar semula Baju Batu Kristal Anda,2,recipe-icon-497,497,3,"48,1;214,1;211,1", Tahap 3 Penyucian semula Baju Zirah Batu Kristal,"48,1,1,4736;48,2,1,3157;48,3,1,2105",0,97497,1,10,-,2,0,4,0,0
0,Tukar semula Kasut Pertanian anda,2,recipe-icon-488,488,3,"217,2;112,1", Tahap 3 Penyucian semula Kasut Pertanian,"112,1,1,4736;112,2,1,3157;112,3,1,2105",0,97488,1,10,-,1,0,4,0,0
0,Tukar semula Kasut Mengumpul Anda,2,recipe-icon-438,438,1,"216,2;113,1", Tahap 1 Penyelenggaraan Semula Kasut Pengumpulan ,"113,1,1,10000",0,99438,1,10,-,3,0,4,0,0
0,Ubahsuai semula Seluar Pengumpul Berlian Anda,2,recipe-icon-544,544,5,"328,1;401,2", Pemprosesan Semula Seluar Kumpul Berlian Tahap 5,"328,1,1,3990;328,2,1,2660;328,3,1,1773;328,4,1,1182;328,5,1,394",0,95544,1,10,-,3,0,4,0,15
0,Tukar semula Kapak Diberkati Anda,2,recipe-icon-491,491,3,"94,1;217,2", Tahap 3 Penyucian semula Kapak yang Diberkati,"94,1,1,4736;94,2,1,3157;94,3,1,2105",0,97491,1,10,-,3,0,4,0,0
0,Ubahsuai semula Cerek Berlian Anda,2,recipe-icon-551,551,5,"310,1;404,2", Pemprosesan Semula Cerek Berlian Tahap 5,"310,1,1,3990;310,2,1,2660;310,3,1,1773;310,4,1,1182;310,5,1,394",0,95551,1,10,-,1,0,4,0,15
0,Tukar semula Cangkul Terkutuk Anda,2,recipe-icon-466,466,2,"81,1;207,2",Pemprosesan semula Cangkul Terkutuklah Lv 2,"81,1,1,6000;81,2,1,4000",0,98466,1,10,-,1,0,4,0,0
0,Tukar semula Sabit Emas Anda,2,recipe-icon-576,576,4,"303,1;218,2", Tahap 4 Penukaran Semula Sabit Emas,"303,1,1,4153;303,2,1,2769;303,3,1,1846;303,4,1,1230",0,96576,1,10,-,3,0,4,0,10
0,Tukar semula Kasut Mengumpul Anda,2,recipe-icon-477,477,2,"114,1;216,2",Pemprosesan semula Kasut Mengumpul Lv 2,"114,1,1,6000;114,2,1,4000",0,98477,1,10,-,3,0,4,0,0
0,Tukar semula Seluar Pertanian Anda,2,recipe-icon-441,441,1,"104,1;207,2", Tahap 1 Penyelenggaraan Semula Seluar Pertanian ,"104,1,1,10000",0,99441,1,10,-,1,0,4,0,0
0,Ubahsuai semula Kot Pejuang Bintang Anda,2,recipe-icon-570,570,6,"346,1;411,1;408,1", Perubahan semula Kot Pakaian Pejuang Bintang Lv 6,"346,1,1,3990;346,2,1,2660;346,3,1,1773;346,4,1,1182;346,5,1,394",0,94570,1,10,-,2,0,4,0,20
0,Tukar semula Beliung Terkutuk Anda,2,recipe-icon-461,461,2,"89,1;216,2",Pemprosesan semula Beliung Terkutuklah Lv 2,"89,1,1,6000;89,2,1,4000",0,98461,1,10,-,3,0,4,0,0
0,Tukar semula Topi Kapas Beruntung Anda,2,recipe-icon-481,481,2,"99,1;207,2",Pemprosesan semula Topi Kapas Bertuah Lv 2,"99,1,1,6000;99,2,1,4000",0,98481,1,10,-,1,0,4,0,0
0,Tukar semula Sikat Emas Anda,2,recipe-icon-522,522,4,"456,1;209,2", Tahap 4 Penukaran Semula Berus Emas,"456,1,1,4153;456,2,1,2769;456,3,1,1846;456,4,1,1230",0,96522,1,10,-,1,0,4,0,10
0,Tukar semula Cangkul Besi Anda,2,recipe-icon-439,439,1,"207,2;80,1", Tahap 1 Penyelenggaraan Semula Cangkul Besi ,"80,1,1,10000",0,99439,1,10,-,1,0,4,0,0
0,Ubahsuai semula Cangkul Berlian Anda,2,recipe-icon-530,530,5,"305,1;404,2", Pemprosesan Semula Cangkul Berlian Tahap 5,"305,1,1,3990;305,2,1,2660;305,3,1,1773;305,4,1,1182;305,5,1,394",0,95530,1,10,-,1,0,4,0,15
0,Tukar semula Seluar Pejuang Emas Anda,2,recipe-icon-517,517,4,"338,1;215,1;212,1", Tahap 4 Penukaran Semula Seluar Pejuang Emas,"338,1,1,4153;338,2,1,2769;338,3,1,1846;338,4,1,1230",0,96517,1,10,-,2,0,4,0,10
0,Tukar semula Jaket Mengumpul Anda,2,recipe-icon-486,486,3,"217,2;121,1", Tahap 3 Penyucian semula Jaket Mengumpul,"121,1,1,4736;121,2,1,3157;121,3,1,2105",0,97486,1,10,-,3,0,4,0,0
0,Ubahsuai semula Kasut Pejuang Bintang Anda,2,recipe-icon-555,555,6,"349,1;411,1;408,1", Perubahan semula Kasut Pejuang Bintang Lv 6,"349,1,1,3990;349,2,1,2660;349,3,1,1773;349,4,1,1182;349,5,1,394",0,94555,1,10,-,2,0,4,0,20
0,Tukar semula Kasut Pertanian Anda,2,recipe-icon-454,454,1,"110,1;207,2", Tahap 1 Penyelenggaraan Semula Kasut Pertanian ,"110,1,1,10000",0,99454,1,10,-,1,0,4,0,0
0,Tukar semula Seluar Pertanian Emas Anda,2,recipe-icon-509,509,4,"353,1;209,2", Tahap 4 Penukaran Semula Seluar Petani Emas,"353,1,1,4153;353,2,1,2769;353,3,1,1846;353,4,1,1230",0,96509,1,10,-,1,0,4,0,10
0,Tukar semula Kapak Emas Anda,2,recipe-icon-514,514,4,"300,1;218,2", Tahap 4 Penukaran Semula Kapak Emas,"300,1,1,4153;300,2,1,2769;300,3,1,1846;300,4,1,1230",0,96514,1,10,-,3,0,4,0,10
0,Tukar semula Sarung Tangan Gauntlet Kristal Anda,2,recipe-icon-495,495,3,"54,1;214,1;211,1", Tahap 3 Penyucian semula Sarung Tangan Gauntlet Batu Kristal,"54,1,1,4736;54,2,1,3157;54,3,1,2105",0,97495,1,10,-,2,0,4,0,0
0,Ubahsuai semula Palu Berlian Anda,2,recipe-icon-536,536,5,"445,1;410,1;407,1", Pemprosesan Semula Tukul Berlian Tahap 5,"445,1,1,3990;445,2,1,2660;445,3,1,1773;445,4,1,1182;445,5,1,394",0,95536,1,10,-,2,0,4,0,15
0,Tukar semula Topi Pejuang Emas Anda,2,recipe-icon-512,512,4,"335,1;215,1;212,1", Tahap 4 Penukaran Semula Topi Pejuang Emas,"335,1,1,4153;335,2,1,2769;335,3,1,1846;335,4,1,1230",0,96512,1,10,-,2,0,4,0,10
0,Tukar semula Busur Kristal Anda,2,recipe-icon-494,494,3,"289,1;214,1;211,1", Tahap 3 Penyucian semula Busur Kristal,"289,1,1,4736;289,2,1,3157;289,3,1,2105",0,97494,1,10,-,2,0,4,0,0
0,Tukar semula Seluar Mengumpul Anda,2,recipe-icon-503,503,3,"217,2;124,1", Tahap 3 Penyucian semula Seluar Mengumpul,"124,1,1,4736;124,2,1,3157;124,3,1,2105",0,97503,1,10,-,3,0,4,0,0
0,Ubahsuai semula Topi Pengumpul Berlian Anda,2,recipe-icon-543,543,5,"325,1;401,2", Pemprosesan Semula Topi Kumpul Berlian Tahap 5,"325,1,1,3990;325,2,1,2660;325,3,1,1773;325,4,1,1182;325,5,1,394",0,95543,1,10,-,3,0,4,0,15
0,Tukar semula Sikat Besi Anda,2,recipe-icon-475,475,2,"454,1;207,2",Pemprosesan semula Berus Besi Lv 2,"454,1,1,6000;454,2,1,4000",0,98475,1,10,-,1,0,4,0,0
0,Tukar semula Topi Mengumpul Anda,2,recipe-icon-478,478,2,"117,1;216,2",Pemprosesan semula Topi Mengumpul Lv 2,"117,1,1,6000;117,2,1,4000",0,98478,1,10,-,3,0,4,0,0
0,Tukar semula Kasut Batu Kristal Anda,2,recipe-icon-498,498,3,"57,1;214,1;211,1", Tahap 3 Penyucian semula Kasut Batu Kristal,"57,1,1,4736;57,2,1,3157;57,3,1,2105",0,97498,1,10,-,2,0,4,0,0
0,Tukar semula Busur Berlian Anda,2,recipe-icon-546,546,5,"451,1;410,1;407,1", Pemprosesan Semula Busur Berlian Tahap 5,"451,1,1,3990;451,2,1,2660;451,3,1,1773;451,4,1,1182;451,5,1,394",0,95546,1,10,-,2,0,4,0,15
0,Ubahsuai semula Kot Pengumpul Bintang Anda,2,recipe-icon-556,556,6,"331,1;402,2", Perubahan semula Kot Pakaian Pengumpul Bintang Lv 6,"331,1,1,3990;331,2,1,2660;331,3,1,1773;331,4,1,1182;331,5,1,394",0,94556,1,10,-,3,0,4,0,20
0,Tukar semula Jaket Pertanian Anda,2,recipe-icon-450,450,1,"101,1;207,2", Tahap 1 Penyelenggaraan Semula Jaket Pertanian ,"101,1,1,10000",0,99450,1,10,-,1,0,4,0,0
0,Ubahsuai semula Berus Cahaya Bintang Anda,2,recipe-icon-553,553,6,"458,1;405,2", Perubahan semula Berus Cahaya Bintang Lv 6,"458,1,1,3990;458,2,1,2660;458,3,1,1773;458,4,1,1182;458,5,1,394",0,94553,1,10,-,1,0,4,0,20
0,Ubahsuai semula Busur Cahaya Bintang Anda,2,recipe-icon-559,559,6,"452,1;411,1;408,1", Perubahan semula Busur Cahaya Bintang Lv 6,"452,1,1,3990;452,2,1,2660;452,3,1,1773;452,4,1,1182;452,5,1,394",0,94559,1,10,-,2,0,4,0,20
0,Tukar semula Kasut Pejuang Emas Anda,2,recipe-icon-518,518,4,"339,1;215,1;212,1", Tahap 4 Penukaran Semula Kasut Pejuang Emas,"339,1,1,4153;339,2,1,2769;339,3,1,1846;339,4,1,1230",0,96518,1,10,-,2,0,4,0,10
0,Tukar semula Pedang Kristal Anda,2,recipe-icon-489,489,3,"42,1;214,1;211,1", Tahap 3 Penyucian semula Pedang Kristal,"42,1,1,4736;42,2,1,3157;42,3,1,2105",0,97489,1,10,-,2,0,4,0,0
0,Tukar semula Seluar Mengumpul Anda,2,recipe-icon-451,451,1,"216,2;122,1", Tahap 1 Penyelenggaraan Semula Seluar Pengumpulan ,"122,1,1,10000",0,99451,1,10,-,3,0,4,0,0
0,Tukar semula Palu Emas Anda,2,recipe-icon-513,513,4,"444,1;215,1;212,1", Tahap 4 Penukaran Semula Palu Emas,"444,1,1,4153;444,2,1,2769;444,3,1,1846;444,4,1,1230",0,96513,1,10,-,2,0,4,0,10
0,Tukar semula Topi Helm Kristal Anda,2,recipe-icon-496,496,3,"45,1;214,1;211,1", Tahap 3 Penyucian semula Helmet Batu Kristal,"45,1,1,4736;45,2,1,3157;45,3,1,2105",0,97496,1,10,-,2,0,4,0,0
0,Ubahsuai semula Sarung Tangan Petani Bintang Anda,2,recipe-icon-575,575,6,"362,1;405,2", Perubahan semula Sarung Tangan Petani Bintang Lv 6,"362,1,1,3990;362,2,1,2660;362,3,1,1773;362,4,1,1182;362,5,1,394",0,94575,1,10,-,1,0,4,0,20
0,Tukar semula Pedang Batu Anda,2,recipe-icon-459,459,1,"40,1;213,1;210,1", Tahap 1 Penyelenggaraan Semula Pedang Batu ,"40,1,1,10000",0,99459,1,10,-,2,0,4,0,0
0,Ubahsuai semula Sarung Tangan Pengumpul Berlian Anda,2,recipe-icon-542,542,5,"327,1;401,2", Pemprosesan Semula Sarung Tangan Kumpul Berlian Tahap 5,"327,1,1,3990;327,2,1,2660;327,3,1,1773;327,4,1,1182;327,5,1,394",0,95542,1,10,-,3,0,4,0,15
0,Tukar semula Sarung Tangan Pertanian Emas Anda,2,recipe-icon-523,523,4,"352,1;209,2", Tahap 4 Penukaran Semula Sarung Tangan Petani Emas,"352,1,1,4153;352,2,1,2769;352,3,1,1846;352,4,1,1230",0,96523,1,10,-,1,0,4,0,10
0,Tukar semula Sikat Berlian Anda,2,recipe-icon-547,547,5,"457,1;404,2", Pemprosesan Semula Berus Berlian Tahap 5,"457,1,1,3990;457,2,1,2660;457,3,1,1773;457,4,1,1182;457,5,1,394",0,95547,1,10,-,1,0,4,0,15
0,Tukar semula Seluar Mengumpul Emas Anda,2,recipe-icon-519,519,4,"323,1;218,2", Tahap 4 Penukaran Semula Seluar Kumpul Emas,"323,1,1,4153;323,2,1,2769;323,3,1,1846;323,4,1,1230",0,96519,1,10,-,3,0,4,0,10
0,Ubahsuai semula Kapak Bintang Anda,2,recipe-icon-578,578,6,"312,1;402,2", Perubahan semula Kapak Bintang Lv 6,"312,1,1,3990;312,2,1,2660;312,3,1,1773;312,4,1,1182;312,5,1,394",0,94578,1,10,-,3,0,4,0,20
0,Tukar semula Seluar Kulit Kristal Anda,2,recipe-icon-470,470,2,"50,1;213,1;210,1",Pemprosesan semula Seluar Kulit Kristal Lv 2,"50,1,1,6000;50,2,1,4000",0,98470,1,10,-,2,0,4,0,0
0,Ubahsuai semula Kasut Pejuang Berlian Anda,2,recipe-icon-541,541,5,"344,1;410,1;407,1", Pemprosesan Semula Kasut Pahlawan Berlian Tahap 5,"344,1,1,3990;344,2,1,2660;344,3,1,1773;344,4,1,1182;344,5,1,394",0,95541,1,10,-,2,0,4,0,15
0,Tukar semula Cincin Kepala Serpihan Kristal Anda,2,recipe-icon-442,442,1,"43,1;213,1;210,1", Tahap 1 Penyelenggaraan Semula Cincin Kepala Serpihan Kristal ,"43,1,1,10000",0,99442,1,10,-,2,0,4,0,0
0,Tukar semula Kot Pejuang Emas Anda,2,recipe-icon-508,508,4,"336,1;215,1;212,1", Tahap 4 Penukaran Semula Kot Pejuang Emas,"336,1,1,4153;336,2,1,2769;336,3,1,1846;336,4,1,1230",0,96508,1,10,-,2,0,4,0,10
0,Tukar semula Jaket Mengumpul Anda,2,recipe-icon-465,465,2,"120,1;216,2",Pemprosesan semula Jaket Mengumpul Lv 2,"120,1,1,6000;120,2,1,4000",0,98465,1,10,-,3,0,4,0,0
0,Tukar semula Seluar Mengumpul Anda,2,recipe-icon-476,476,2,"123,1;216,2",Pemprosesan semula Seluar Mengumpul Lv 2,"123,1,1,6000;123,2,1,4000",0,98476,1,10,-,3,0,4,0,0
0,Tukar semula Busur Emas Anda,2,recipe-icon-521,521,4,"450,1;215,1;212,1", Tahap 4 Penukaran Semula Busur Emas,"450,1,1,4153;450,2,1,2769;450,3,1,1846;450,4,1,1230",0,96521,1,10,-,2,0,4,0,10
0,Ubahsuai semula Sarung Tangan Pejuang Bintang Anda,2,recipe-icon-569,569,6,"347,1;411,1;408,1", Perubahan semula Sarung Tangan Pejuang Bintang Lv 6,"347,1,1,3990;347,2,1,2660;347,3,1,1773;347,4,1,1182;347,5,1,394",0,94569,1,10,-,2,0,4,0,20
0,Tukar semula Seluar Pertanian Anda,2,recipe-icon-499,499,3,"106,1;208,2", Tahap 3 Penyucian semula Seluar Pertanian,"106,1,1,4736;106,2,1,3157;106,3,1,2105",0,97499,1,10,-,1,0,4,0,0
0,Ubahsuai semula Beliung Berlian Anda,2,recipe-icon-552,552,5,"307,1;401,2", Pemprosesan Semula Beliung Berlian Tahap 5,"307,1,1,3990;307,2,1,2660;307,3,1,1773;307,4,1,1182;307,5,1,394",0,95552,1,10,-,3,0,4,0,15
0,Tukar semula Palu Kristal Anda,2,recipe-icon-492,492,3,"443,1;214,1;211,1", Tahap 3 Penyucian semula Palu Kristal,"443,1,1,4736;443,2,1,3157;443,3,1,2105",0,97492,1,10,-,2,0,4,0,0
0,Tukar semula Sarung Tangan Pertanian Anda,2,recipe-icon-500,500,3,"109,1;208,2", Tahap 3 Penyucian semula Sarung Tangan Pertanian,"109,1,1,4736;109,2,1,3157;109,3,1,2105",0,97500,1,10,-,1,0,4,0,0
0,Ubahsuai semula Kot Pejuang Berlian Anda,2,recipe-icon-531,531,5,"341,1;410,1;407,1", Pemprosesan Semula Baju Pahlawan Berlian Tahap 5,"341,1,1,3990;341,2,1,2660;341,3,1,1773;341,4,1,1182;341,5,1,394",0,95531,1,10,-,2,0,4,0,15
0,Tukar semula Kasut Mengumpul Anda,2,recipe-icon-484,484,3,"217,2;115,1", Tahap 3 Penyucian semula Kasut Mengumpul,"115,1,1,4736;115,2,1,3157;115,3,1,2105",0,97484,1,10,-,3,0,4,0,0
0,Tukar semula Beliung Diberkati Anda,2,recipe-icon-504,504,3,"90,1;217,2", Tahap 3 Penyucian semula Beliung yang Diberkati,"90,1,1,4736;90,2,1,3157;90,3,1,2105",0,97504,1,10,-,3,0,4,0,0
0,Ubahsuai semula Sabit Bintang Anda,2,recipe-icon-566,566,6,"315,1;402,2", Perubahan semula Sabit Bintang Lv 6,"315,1,1,3990;315,2,1,2660;315,3,1,1773;315,4,1,1182;315,5,1,394",0,94566,1,10,-,3,0,4,0,20
0,Tukar semula Kasut Kulit Kristal Anda,2,recipe-icon-464,464,2,"56,1;213,1;210,1",Pemprosesan semula Kasut Kulit Kristal Lv 2,"56,1,1,6000;56,2,1,4000",0,98464,1,10,-,2,0,4,0,0
0,Tukar semula Baju Kulit Kristal Anda,2,recipe-icon-471,471,2,"47,1;213,1;210,1",Pemprosesan semula Baju Atasan Kulit Kristal Lv 2,"47,1,1,6000;47,2,1,4000",0,98471,1,10,-,2,0,4,0,0
0,Tukar semula Sarung Tangan Mengumpul Anda,2,recipe-icon-474,474,2,"126,1;216,2",Pemprosesan semula Sarung Tangan Mengumpul Lv 2,"126,1,1,6000;126,2,1,4000",0,98474,1,10,-,3,0,4,0,0
0,Ubahsuai semula Seluar Pejuang Bintang Anda,2,recipe-icon-572,572,6,"348,1;411,1;408,1", Perubahan semula Seluar Pejuang Bintang Lv 6,"348,1,1,3990;348,2,1,2660;348,3,1,1773;348,4,1,1182;348,5,1,394",0,94572,1,10,-,2,0,4,0,20
0,Ubahsuai semula Kasut Pengumpul Bintang Anda,2,recipe-icon-562,562,6,"334,1;402,2", Perubahan semula Kasut Pengumpul Bintang Lv 6,"334,1,1,3990;334,2,1,2660;334,3,1,1773;334,4,1,1182;334,5,1,394",0,94562,1,10,-,3,0,4,0,20
0,Tukar semula Sikat Tembaga Anda,2,recipe-icon-458,458,1,"453,1;207,2", Tahap 1 Penyelenggaraan Semula Berus Tembaga ,"453,1,1,10000",0,99458,1,10,-,1,0,4,0,0
0,Ubahsuai semula Seluar Petani Berlian Anda,2,recipe-icon-532,532,5,"358,1;404,2", Pemprosesan Semula Seluar Tani Berlian Tahap 5,"358,1,1,3990;358,2,1,2660;358,3,1,1773;358,4,1,1182;358,5,1,394",0,95532,1,10,-,1,0,4,0,15
0,Ubahsuai semula Topi Pejuang Bintang Anda,2,recipe-icon-571,571,6,"345,1;411,1;408,1", Perubahan semula Topi Pejuang Bintang Lv 6,"345,1,1,3990;345,2,1,2660;345,3,1,1773;345,4,1,1182;345,5,1,394",0,94571,1,10,-,2,0,4,0,20
0,Tukar semula Palu Besi Anda,2,recipe-icon-482,482,2,"442,1;213,1;210,1",Pemprosesan semula Tukul Besi Lv 2,"442,1,1,6000;442,2,1,4000",0,98482,1,10,-,2,0,4,0,0
0,Tukar semula Seluar Pertanian Anda,2,recipe-icon-473,473,2,"105,1;207,2",Pemprosesan semula Seluar Pertanian Lv 2,"105,1,1,6000;105,2,1,4000",0,98473,1,10,-,1,0,4,0,0
0,Ubahsuai semula Sarung Tangan Pejuang Berlian Anda,2,recipe-icon-534,534,5,"342,1;410,1;407,1", Pemprosesan Semula Sarung Tangan Pahlawan Berlian Tahap 5,"342,1,1,3990;342,2,1,2660;342,3,1,1773;342,4,1,1182;342,5,1,394",0,95534,1,10,-,2,0,4,0,15
0,Ubahsuai semula Kot Petani Bintang Anda,2,recipe-icon-574,574,6,"361,1;405,2", Perubahan semula Kot Petani Bintang Lv 6,"361,1,1,3990;361,2,1,2660;361,3,1,1773;361,4,1,1182;361,5,1,394",0,94574,1,10,-,1,0,4,0,20
0,Tukar semula Topi Mengumpul Anda,2,recipe-icon-453,453,1,"116,1;216,2", Tahap 1 Penyelenggaraan Semula Topi Pengumpulan ,"116,1,1,10000",0,99453,1,10,-,3,0,4,0,0
0,Tukar semula Pelindung Kaki Kristal Anda,2,recipe-icon-493,493,3,"51,1;214,1;211,1", Tahap 3 Penyucian semula Seluar Zirah Kaki Kristal,"51,1,1,4736;51,2,1,3157;51,3,1,2105",0,97493,1,10,-,2,0,4,0,0
0,Tukar semula Topi Kulit Kristal Anda,2,recipe-icon-467,467,2,"44,1;213,1;210,1",Pemprosesan semula Topi Crystalhide Topi Keledar Pahlawan Lv 2,"44,1,1,6000;44,2,1,4000",0,98467,1,10,-,2,0,4,0,0
0,Tukar semula Beliung Emas Anda,2,recipe-icon-529,529,4,"301,1;218,2", Tahap 4 Penukaran Semula Beliung Emas,"301,1,1,4153;301,2,1,2769;301,3,1,1846;301,4,1,1230",0,96529,1,10,-,3,0,4,0,10
0,Ubahsuai semula Seluar Pengumpul Bintang Anda,2,recipe-icon-558,558,6,"333,1;402,2", Perubahan semula Seluar Pengumpul Bintang Lv 6,"333,1,1,3990;333,2,1,2660;333,3,1,1773;333,4,1,1182;333,5,1,394",0,94558,1,10,-,3,0,4,0,20
0,Tukar semula Busur Logam Anda,2,recipe-icon-579,579,2,"288,1;213,1;210,1",Pemprosesan semula Busur Logam Lv 2,"288,1,1,6000;288,2,1,4000",0,98579,1,10,-,2,0,4,0,0
0,Tukar semula Topi Keras Beruntung Anda,2,recipe-icon-580,580,3,"100,1;208,2", Tahap 3 Penyucian semula Topi Keras Bertuah,"100,1,1,4736;100,2,1,3157;100,3,1,2105",0,97580,1,10,-,1,0,4,0,0
0,Tukar semula Pedang Emas Anda,2,recipe-icon-581,581,4,"317,1;215,1;212,1", Tahap 4 Penukaran Semula Pedang Emas,"317,1,1,4153;317,2,1,2769;317,3,1,1846;317,4,1,1230",0,96581,1,10,-,2,0,4,0,10
0,Ubahsuai semula Pedang Berlian Anda,2,recipe-icon-582,582,5,"318,1;410,1;407,1", Pemprosesan Semula Pedang Berlian Tahap 5,"318,1,1,3990;318,2,1,2660;318,3,1,1773;318,4,1,1182;318,5,1,394",0,95582,1,10,-,2,0,4,0,15
0,Ubahsuai semula Palu Cahaya Bintang Anda,2,recipe-icon-583,583,6,"446,1;411,1;408,1", Perubahan semula Tukul Cahaya Bintang Lv 6,"446,1,1,3990;446,2,1,2660;446,3,1,1773;446,4,1,1182;446,5,1,394",0,94583,1,10,-,2,0,4,0,20
0, Resipi Minuman Pemulihan Tenaga - Besar,2,recipe-icon-595,595,6,"398,4;399,4;400,4;479,1", Resipi Pemulihan Tenaga Pertempuran - Tahap 6,"461,1,1,10000",0,94595,1,10,-,2,0,4,0,0
0, Resipi Minuman Pemulihan Tenaga - Sederhana,2,recipe-icon-589,589,5,"395,4;396,4;397,4;479,1", Resipi Pemulihan Tenaga Pertempuran - Tahap 5,"460,1,1,10000",0,95589,1,10,-,2,0,4,0,0
0, Resipi Minuman Pemulihan Tenaga - Besar,2,recipe-icon-592,592,3,"183,4;184,4;185,4;479,1", Resipi Pemulihan Tenaga Pertempuran - Besar,"297,1,1,10000",0,97592,1,10,-,2,0,4,0,0
0, Resipi Minuman Pemulihan Tenaga - Kecil,2,recipe-icon-590,590,4,"392,4;394,4;393,4;479,1", Resipi Pemulihan Tenaga Pertempuran - Tahap 4,"459,1,1,10000",0,96590,1,10,-,2,0,4,0,0
0, Resipi Minuman Pemulihan Tenaga - Kecil,2,recipe-icon-588,588,1,"177,4;178,4;179,4;479,2", Resipi Pemulihan Tenaga Pertempuran - Kecil,"295,1,1,10000",0,99588,1,10,-,2,0,4,0,0
0, Resipi Minuman Pemulihan Tenaga - Sederhana,2,recipe-icon-585,585,2,"180,4;181,4;182,4;479,1", Resipi Pemulihan Tenaga Pertempuran - Sederhana,"296,1,1,10000",0,98585,1,10,-,2,0,4,0,0
0, Resipi Minuman Pemulihan Tenaga - Besar,2,recipe-icon-586,586,6,"380,4;382,4;381,4;479,1", Resipi Pemulihan Tenaga Penanaman - Tahap 6,"461,1,1,10000",0,94586,1,10,-,1,0,4,0,0
0, Resipi Minuman Pemulihan Tenaga - Sederhana,2,recipe-icon-587,587,5,"377,4;378,4;379,4;479,1", Resipi Pemulihan Tenaga Penanaman - Tahap 5,"460,1,1,10000",0,95587,1,10,-,1,0,4,0,0
